EIN	Name
471334302	TAKOMA REGIONAL HOSPITAL FOUNDATION INC
471345819	PALMETTO HEALTH-UNIVERSITY OF SOUTH CAROLINA MEDICAL GROUP
471358542	UNIVERSITY OF TENNESSEE WEST INSTITUTE FOR CANCER RESEARCH
471358788	PLEASANT VALLEY MEDICAL GROUP INC
471378767	BIG BEND HEALTHCARE COALITIONINC
471426550	TRENTON HEALTH TEAM ACO INC
471435128	SUPER HAPPY HEALTHY KIDS INC
471442997	MEDICAL DEBT RESOLUTION INC
471444061	NORTH OLYMPIC HEALTHCARE NETWORK
471482665	HUDSON RIVER HEALTHCARE LOCAL DEVELOPMENT CORPORATION
471487930	GRACE MEDICAL HOME FOUNDATION INC
471535937	HEALTH CARE FOUNDATION FOR VENTURA COUNTY INC
471567798	NAPA MEDICAL RESEARCH FOUNDATION
471575922	SILVER STATE HEALTH SERVICES
471578974	CHINA US HEALTH ALLIANCE INC
471582973	MONTEFIORE MEDICINE ACADEMIC HEALTH SYSTEM INC
471600873	SUSQUEHANNA HEALTH INNOVATION CENTER INC
471604216	UNIVERSITY OF EXETER US FOUNDATION
471619621	HEPHZIBAH BEHAVIORAL HEALTH SERVICES INC
471637397	ST CLARES HOSPITAL MEDICAL STAFF
471678972	NATIONAL HEALTH IT COLLABORATIVE FOR THE UNDERSERVED INC
471686351	FOUNDATION FOR UNIVERSITY HOSPITAL A NEW JERSEY NONPROFIT CORPORATION
471697044	HEALTHCARE VISION INC
471709303	LIFESAVING CHILDRENS HOSPITALS AND CLINICS
471729771	CENTRICITY HEALTHCARE USERS GROUP
471757744	CANCER CARE HOSPITAL AND RESEARCH CENTER FOUNDATION
471765878	NEW MAINERS PUBLIC HEALTH INITIATIVE
471766892	MERIDIAN CENTER FOR HEALTH
471777904	HORIZON HEALTH PARTNERS INC
471792728	ASSOCIATION OF WEB-BASED HEALTH INSURANCE BROKERS
471803207	STRATEGIC HEALTH INFORMATION EXCHANGE COLLABORATIVE
471826429	GLOBAL OVED DEI SEMINARY UNIVERSITY
471836448	NORTH DAKOTA PROFESSIONAL HEALTH PROGRAM INC
471859775	INTERNATIONAL MEDICAL RESPONSE FOUNDATION
471865867	FLORIDA ALLIANCE FOR HEALTHY COMMUNITIES INC
471881744	ADVENTHEALTH WEST FLORIDA AMBULATORY SERVICES INC
471930457	ALEXIAN BROTHERS MEDICAL CARE GROUP NFP
471948283	CLACKAMAS COUNTY SHERIFFS OFFICE INDEPENDENT RETIREMENT MEDICAL TR
471951789	POPE FRANCIS HOME AND SCHOOL INC
471961543	PARTNERS 4 HEALTH INC
471994752	COLLEGE OF MISSIONARY AVIATION INC
472006771	HANDS FOR GLOBAL HEALTH
472020718	PIKEVILLE MEDICAL CENTER FOUNDATION FOR QUALITY HEALTHCARE INC
472030338	BACKYARD HEALTHCARE PROJECT
472042581	GOSPEL LIGHT MENNONITE CHURCH MEDICAL AID PLAN INC
472044966	SOUTHERN INDIANA GRADUATE MEDICAL EDUCATION CONSORTIUM INC
472057266	ALPHA DELTA PHI UNIVERSITY OF WASHINGTON
472060670	DOORWAY TO COLLEGE FOUNDATION INC
472062464	MEDICAL MINISTRIES INC
472066463	HEALTHCARE SERVICES PLATFORM CONSORTIUM
472068532	CENTER FOR HEALTH PROMOTION AND DISEASE PREVENTION
472101351	COMPLETE HEALTH WITH PACE
472117443	ST ROSE HEALTH CENTER CO HAYS MEDICAL CENTER
472124459	FQHC HEALTH NETWORK INC NFP
472143964	CHILDRENS HEALTH MINISTRIES
472153698	CUMMINGS GRADUATE INSTITUTE FOR BEHAVIORAL HEALTH
472163956	ARKANSAS CHAMPIONS FOR HEALTH
472168025	HEALTHY MARKETS ASSOCIATION
472176553	EASTERN OREGON HEALTHY LIVING ALLIANCE
472185616	COMMUNICARE HEALTH FOUNDATION
472198643	UNIVERSITY ACADEMY OF CENTRAL LOUIS
472209056	ALBERT EINSTEIN COLLEGE OF MEDICINE INC
472212776	WHITE MEMORIAL COMMUNITY HEALTH CENTER
472227058	PALESTINIAN AMERICAN MEDICAL ASSOCIATION
472231080	ALTIUS INSTITUTE FOR BIOMEDICAL SCIENCES
472248298	LAHEY PHYSICIAN COMMUNITY ORGANIZATION I INC
472257585	NATIONAL PETROLEUM COUNCIL HEALTH AND WELFARE TRUST
472276749	TENNESSEE HEALTH INFORMATION MANAGEMENT ASSOCIATION GROUP
472296503	ST LUKES FAMILY MEDICAL GROUP INC
472298725	EAST CENTRAL ALABAMA AREA HEALTH ED
472298734	QUEENS UNIVERSITY OF CHARLOTTE ENDOWMENT
472330752	COLORADO DIGITAL HEALTH
472351434	LIVE BETTER HEALTHY FOUNDATION INC
472360513	ALEXIAN BROTHERS - AHS MIDWEST REGION HEALTH CO
472373203	UNIVERSITY OF LOUISVILLE REAL ESTATE FOUNDATION INC
472393817	DOWNTOWN COLLEGE PREP FOUNDATION
472417939	DRA BEHAVIORAL HEALTH CORPORATION
472420967	AMERICAN UNIVERSITY OF MYANMAR INC CO KLAFTER OLSEN AND LESSER LLP
472424768	COMMUNITY HEALTH INITIATIVES INC
472438884	INDIANA COLLEGE PREPARATORY SCHOOL INC
472459747	PELZMAN FOUNDATION FOR HEALTHCARE INNOVATIONINC
472468259	SARATOGA REGIONAL MEDICAL PC
472486060	SOUTHWEST GENERAL MEDICAL STAFF ORGANIZATION
472497894	WARREN HEALTH AND FITNESS INC
472498200	CENTER FOR HEALTH INNOVATION
472505177	SOUTHWEST PENNSYLVANIA ENVIRONMENTAL HEALTH PROJECT
472507725	GRAND CANYON UNIVERSITY
472508009	STRATUM HEALTH SYSTEM INC
472510993	TEXAS ASSOCIATION OF CITY AND COUNTY HEALTH OFFICIALS
472528627	SOMOS HEALTHCARE PROVIDERS INC
472533655	PARTNERS FOR COLLEGE AFFORDABILITY AND PUBLIC TRUST
472553196	UNIVERSITY HEALTH CARE INC
472590506	MINNESOTA COMMUNITY HEALTHCARE NETWORK
472591463	HOWARD UNIVERSITY INTERNATIONAL
472593574	BATON ROUGE HEALTH DISTRICT
472594610	MAIRA HEALTHCARE FOUNDATION NFP
472601485	ATHLETICARE SPORTS HEALTH FOUNDATION
472606680	MISSION ANIMAL HOSPITAL
472613531	NYU LANGONE HEALTH SYSTEM
472617610	LOVE OF CHRIST BIBLE COLLEGE
472641606	CHRISTIAN MEDICAL MINISTRIES INC
472642764	OMCNS MEDICAL FACILITIES INC
472651553	WOMEN FOR A HEALTHY ENVIRONMENT
472654761	COMMUNITY HIGHERED INSTITUTE DBA COMMUNITY CARE COLLEGE CLARY
472665045	WINTHROP COMMUNITY MEDICAL AFFILIATES PC
472668088	COTTONWOOD MEDICAL CLINIC INC
472671013	COMMUNITY HEALTH INITIATIVE OF ORANGE COUNTY
472715016	INTERDISCIPLINARY ASSOCIATION FOR POPULATION HEALTH SCIENCE
472735838	HEALTH-CARE EDUCATION AND LIVING IN POVERTY
472736029	HEALTH FIRST HEALTH PLANS INC
472768711	SUMMITS EDUCATION
472799327	EMMANUEL CHRISTIAN UNIVERSITY CORP
472836992	TEXAS MEDICAL CENTER FOUNDATION
472841387	CULPEPER HOSPITAL AUXILIARY
472845823	INDEPENDENT HEALTH NETWORK INC
472856220	JEFFREY UNIVERSITY A CALIFORNIA NON PROFIT RELIGIOUS CORPORATION
472857600	MUNSON HEALTHCARE CADILLAC HOSPITAL FOUNDATION
472867445	UNIVERSITY INDUSTRY DEMONSTRATION PARTNERSHIP INC
472883629	LOW COST ANIMAL MEDICAL CENTER
472893430	BAPTIST HEALTH FOUNDATION MADISONVILLE INC
472895862	HEALTHY LIVING AND FITNESS INC
472912503	CHRIST COMMUNITY HEALTH COALITION
472922502	GRADY HEALTH RESOURCES INC
472926810	HEALTHY FOOD AMERICA
472964718	MOUNT SINAI MEDICAL LEGAL PARTNERSHIP INC
472975827	SPROUTS HEALTHY COMMUNITIES FOUNDATION
473000476	VEBA TRUST FOR RETIREES OF FOOTHILL-DE ANZA COMMUNITY COLLEGE
473010424	MEMORIAL HOSPITAL FOUNDATION
473013519	CHAMPION CHRISTIAN COLLEGE INC
473016571	ADVANCED MEDICAL EMERGENCY RESOURCE COALITION INC
473028565	SUNYATA FOUNDATION
473028931	TWIN RIVERS MEDICAL PC
473033550	BAPTIST HEALTH FOUNDATION CORBIN INC
473034746	PARIS COMMUNITY HOSPITAL FOUNDATION INC
473054125	READING HOSPITAL FOUNDATION
473068888	METALS 4 MEDICAL MIRACLES INC
473073124	TRINITY HEALTH PACE
473090066	MIAMI CANCER CENTER INSTITUTE AT BAPTIST HEALTH INC
473095097	PASSAGEWAYS MEDICAL THERAPY INC
473097839	CALIFORNIA STATE UNIVERSITY DOMINGUEZ HILLS PHILANTHROPIC FOUNDATION
473118698	PROVENTION HEALTH FOUNDATION INC
473135848	MIDWEST COLLEGE OF THEOLOGY INTERNATIONAL INC
473173513	EASTERN IOWA COMMUNITY COLLEGE DISTRICT DOWNTOWN CAMPUS FOUNDATION
473181723	1DIVINELINE2HEALTH
473197108	COMPASSION HEALTH TOLEDO
473237659	BERNALILLO COUNTY COMMUNITY HEALTH COUNC
473263272	CHALLIS AREA HEALTH CENTER INC
473273828	GENERATIONS HOLDINGS INC CO GENERATIONS FAMILY HEALTH CENTER
473286543	HANDS TOGETHER FAMILY HEALTH CENTER INC
473298660	MOSAIC FAMILY HEALTH INC
473335175	WESTSIDE REGIONAL MEDICAL STAFF INC
473348689	SOUTH SEATTLE WOMENS HEALTH FOUNDAT
473351483	HEALTH CARE PROVIDERS FOR GREATER ACCESS INC
473360048	HEALTHY SCHOOL FOOD COLLABORATIVE INC
473361326	ASSOC OF INDEPENDENT HOSPITALITY PROFESSIONALS
473379283	CHESHIRE HEALTH SERVICES INC
473403762	BAPTIST HEALTH FOUNDATION INC
473408746	SWINE HEALTH INFORMATION CENTER INC
473433542	LATIN COLLEGE PREPARATORY CHARTER SCHOOL INC
473447709	DELAWARE HEALTH SCIENCES ALLIANCE LLC
473515830	POINT PARK UNIVERSITY FOUNDATION
473530185	RURAL REGIONAL COLLEGE OF NORTHERN PENNSYLVANIA
473549116	ADAMS REGIONAL EMERGENCY MEDICAL SERVICES INC
473560167	SUNY MARITIME FOUNDATION
473566566	HEALTH CARE EXECUTIVE GROUP
473594754	CHILDRENS MEDICAL FUND CHILD LIFE ENDOWMENT CORP
473609601	PACIFIC RIM CHRISTIAN UNIVERSITY
473638935	DELAWARE CENTER FOR HEALTH INNOVATION INC
473664000	NEW MEXICO COALITION FOR HEALTHCARE VALUE
473694893	NORTHWEST MEDICAL CENTER FOUNDATION INC
473707440	NATIONAL INSTITUTE FOR PUBLIC SAFETY HEALTH INC
473731895	PRIMUS UNIVERSITY OF THEOLOGY INTER
473763374	JONES MEMORIAL HOSPITAL FOUNDATION
473767341	EAST MOUNTAIN HEALTH PHYSICIANS
473769205	PENN STATE HEALTH
473791968	FIRST NATIONS COMMUNITY HEALTHSOURCE PHARMACY
473792550	SHORE MEDICAL CENTER-MEDICAL STAFF
473809253	TEXAS HEALTH ACTION
473811191	EASTERN WAYNE EMERGENCY MEDICAL SERVICES INC
473818327	MEDICAL STAFF OF ST JOHN HOSPITAL AND MEDICAL CENTER
473912229	COLUMBIA PIPELINE GROUP UNION LIFE AND MEDICAL BENEFITS VEBA TRUST
473912727	MEDICAL SOCIETY OF SEDGWICK COUNTY PHYSICIAN LEADERSHIP ALLIANCE INC
473992060	AIM FOR MENTAL HEALTH INC
474034471	CALIFORNIA COVERAGE AND HEALTH INITIATIVES
474036876	ALPHA SIGMA PHI AT MICHIGAN STATE UNIVERSITY
474046611	TAHLEQUAH HOSPITAL AUXILIARY INC
474062921	SOCIETY FOR ADVANCING BIOMEDICAL IMAGING CORP
474085326	ALPHA SIMGA PHI AT THE UNIVERSITY OF COLORADO AT BOULDER
474100326	CHRISTIAN HEALTHCARE CENTERS INC
474101801	FUND FOR A HEALTHIER COLORADO
474164402	TEXAS HEALTH AND ENVIRONMENT ALLIANCE INC
474178944	DIGESTIVE HEALTH FOUNDATION
474199753	GREATER MILWAUKEE CENTER FOR HEALTH AND WELLNESS INC
474221241	UCM CARE NETWORK MEDICAL GROUP INC
474227452	CENTRAL VALLEY HEALTH INFORMATION E
474240714	ALLIANCE ADV INFANT MENTAL HEALTH
474258282	READING HOSPITAL MEDICAL STAFF ASSOCIATION
474281794	PUBLIC ARTS FOR HEALTH AND STABILIT
474302610	VERMONT COLLEGE OF FINE ARTS FOUNDATION INC
474302904	NEW ORLEANS COLLEGE FOOTBALL CHAMPIONSHIP HOST COMMITTEE INC
474325468	HARBOR EMERGENCY MEDICAL EDUCATION FOUNDATION
474333478	COLLABORATING FOR BETTER HEALTH
474334771	HEALTHY BIRTH AND INFANT BRAINS FOUNDATION
474336051	BABY UNIVERSITY
474365018	CORPORATION OF WESTERN GOVERNORS UNIVERSITY
474377679	MEDICAL CARE OF QUEENS PC
474391083	ASPIRE INDIANA HEALTH INC
474393365	ADELANTE COMMUNITY HEALTH CENTER
474398187	HEALTH POINTE
474425987	COLLEGE FOR SOCIAL INNOVATION INC
474460513	HEALTHRIGHT 360 FOUNDATION
474466737	SOUTH DAKOTA SOIL HEALTH COALITION
474494285	UNIVERSITY SERVICES INC DBA UMASS CLUB
474532260	HILLEL AT FLORIDA INTERNATIONAL UNIVERSITY
474539584	WESTCHESTER HEALTH MEDICAL PC
474548573	UNIVERSITY OF TOKYO NEW YORK OFFICE INC
474585630	BUSH GLOBAL HEALTH INITIATIVE
474591341	COVERED BRIDGE HEALTHCARE OF ST JOSEPH COUNTY
474641750	VALUE BASED MEDICAL TECHNOLOGY ASSOCIATION
474645512	SWEDISH MEDICAL CENTER MEDICAL STAFF DUES FUND
474670026	COLLEGE BEYOND
474673365	GREENE COUNTY HEALTH INC
474724257	TEXAS HEALTH BACK CARE
474744755	HEALTH SCIENCES EDUCATION FACILITY CORPORATION
474773124	GOLDEN VALLEY HEALTH CENTERS FOUNDATION
474784379	WOMEN S HEALTH INNOVATIONS OF ARIZONA
474787535	HOPE MEDICAL OF WASHINGTON
474829539	UPSTATE FAMILY HEALTH CENTER INC
474841103	VNA HEALTH GROUP OF NEW JERSEY LLC
474856081	BRANCH COLLEGE OF MINISTRY
474876589	PENNSYLVANIA HEALTH ACCESS NETWORK
474890906	SOUTHEASTHEALTH SYSTEM
474900733	GREENBRIER COUNTY HEALTH ALLIANCE
474909033	URBAN HEALTH AND WELLNESS GROUP INC
474914970	SKY RIDGE MEDICAL CENTER MEDICAL STAFF FUND
474951256	TRI-STATE STEM M EARLY COLLEGE HIGH SCHOOL
474960128	MEDICAL TECHNOLOGY ENTERPRISE CONSORTIUM
474969600	BROWN COUNTY WOMENS HEALTH LLC
474984588	INNOVATING HEALTH INTERNATIONAL INC
475012525	SOUTHWEST GEORGIA HEALTHCARE CLINICS INC
475029024	MIDDLETOWN EMERGENCY MEDICAL SERVICES IN
475042958	UNITY SCHOOLS SOCAL
475060072	SOUTH BAY SPORTS HEALTH AND RECREATION
475070124	LCMCD-LCHCD RETIREE HEALTH INS TR F
475134365	ANGKOR COLLEGE FUND
475139116	MARCROFT MEDICAL ASSOCIATES PC
475148345	COX COLLEGE
475185220	THETA XI FRATERNITY GAMMA PSI CHAPTER
475235322	OMAHA FIREFIGHTERS HEALTHCARE TRUST
475244984	TRINITY HEALTH LIFE PENNSYLVANIA INC
475271468	JOHNSON UNIVERSITY FLORIDA INC
475272934	PINES OF SARASOTA HEALTHCARE LLC
475320855	VA MEDICAL FOSTER HOME
475327498	STUDENT SENATE FOR CALIFORNIA COMMUNITY COLLEGES
475341510	NEOHUMANIST COLLEGE OF ASHEVILLE
475344439	REQUIPMENT DURABLE MEDICAL EQUIPMENT AND ASSISTIVE TECHNOLOGY REUSE PROGRAM INC
475349004	SOIL HEALTH INSTITUTE
475351008	CAMPAIGN FOR MEDICAL DISCOVERY
475375362	RADIANT HEALTH NATURAL MEDICAL CENTER
475387652	NORTHEAST TUSCOLA HEALTHCARE CORP
475428483	INTEGRATED HEALTH CENTER CORP
475435852	STATE COLLEGE AREA SCHOOL DISTRICT EDUCATION FOUNDATION INC
475446921	BLACK HEALTH MATTERS FOUNDATION
475447831	CDCHOICES AND PARTICIPATING EMPLOYING CONSUMERS HEALTH PLAN
475513250	COMMUNITY HEALTH RESOURCE NETWORK INC
475550533	HEALTH RESEARCH INSTITUTE
475560522	INTEGRATED BEHAVIORAL HEALTH MANAGEMENT INC
475607606	ORION HEALTH INSURANCE POOL INC
475608447	SHARE HEALTH SOUTHEAST GEORGIA INC
475671451	TINTON FALLS EMERGENCY MEDICAL SERVICES INC
476000224	MARY LANNING HOSPITAL TRUST
476024984	BEATRICE COMMUNITY HOSPITAL FOUNDATION INC
476025325	SUMMIT CHRISTIAN COLLEGE
476027511	UNIVERSITY OF NEBRASKA AT OMAHA ALUMNI ASSOCIATION
476032846	PROVIDENCE MEDICAL CENTER FOUNDATION
476033773	NEBRASKA MEDICAL EDUCATION FUND INC
476036827	NEBRASKA MEDICAL FOUNDATION CO US BANK
476042402	COLLEGE WORLD SERIES OF OMAHA INC
476058269	NEBRASKA HOSPITAL ASSOCIATION RESEARCH AND EDUCATIONAL FOUNDATION
476089800	MCCOOK COLLEGE FOUNDATION
476105603	CHILDRENS HOSPITAL AND MEDICAL CTR FOUNDATION
476174317	QUALITY LIVING INC HEALTH CARE PLAN
476181441	MAPES INDUSTRIES INC EMPLOYEES GROUP HEALTH PLAN VEBA TRUST
476448861	TWU LOCAL 100 HEALTH FUND
476584995	NYSNA-KINGSBROOK RN RETIREE HEALTH PLAN
476612352	KENTUCKY CONSTRUCTION INDUSTRY HEALTH TRUST
476612366	IMPACT ENERGY INDUSTRY HEALTH TRUST
476637864	HEALTH FACILITIES INSURANCE TRUST
476660978	ABC-HBA OF MICHIGAN HEALTH TRUST FUND
476685299	KAISER FOUNDATION HEALTH PLAN INC RETIREE HEALTH AND WELFARE PLAN
476743456	USW MARKET FORGE RETIREE HEALTH TRUST
477100156	MILENIA HEALTH BENEFIT TRUST
477115400	GREEN MOUNTAIN POWER CORPORATION RETIREE MEDICAL BENEFIT TRUST
477358956	NYSUT MEMBER BENEFITS CATASTROPHE MAJOR MEDICAL INSURANCE TRUST
477404015	UAW RETIREES HEALTH CARE TRUST
480213995	FARMHOUSE FRATERNITY KANSAS STATE UNIVERSITY CHAPTER
480289660	KANSAS MEDICAL SOCIETY
480291250	KANSAS UNIVERSITY ALUMNI ASSOCIATION DBA KU ALUMNI ASSOCIATION
480410159	MEDICAL SOCIETY OF SEDGWICK COUNTY
480495058	ALUMNI ASSOCIATION OF KANSAS STATE UNIVERSITY
480543715	SOUTHWESTERN COLLEGE
480543724	CENTRAL KANSAS MEDICAL CENTER
480543728	STERLING COLLEGE
480543729	KANSAS WESLEYAN UNIVERSITY
480543734	BETHANY COLLEGE
480543736	MCPHERSON COLLEGE
480543766	BAKER UNIVERSITY
480543772	OTTAWA UNIVERSITY
480543782	BETHEL COLLEGE
480543786	KANSAS HOSPITAL ASSOCIATION
480547702	FRIENDS UNIVERSITY
480547719	ST FRANCIS HEALTH CENTER INC
480547734	KANSAS UNIVERSITY ENDOWMENT ASSOCIATION
480547846	UNIVERSITY OF SAINT MARY INC
480548361	HESSTON COLLEGE
480554341	BARCLAY COLLEGE
480556716	NEWMAN UNIVERSITY INC
480556726	TABOR COLLEGE INC
480559090	MANHATTAN CHRISTIAN COLLEGE
480576044	WYANDOT CENTER FOR COMMUNITY BEHAVIORAL HEALTHCARE INC
480577656	CENTRAL CHRISTIAN COLLEGE OF KANSAS
480581966	STUDENT UNION CORPORATION OF THE UNIVERSITY OF KANSAS MEDICAL CENTER
480608889	KANSAS CITY COLLEGE AND BIBLE SCHOOL INC
480608913	SALEM HOSPITAL INC
480617739	GREAT PLAINS HEALTH ALLIANCE INC
480620714	TEACHERS AND EMPLOYEES ASSOC OF KANSAS STATE UNIVERSITY
480622380	H L SNYDER MEDICAL FOUNDATION
480623882	DONNELLY COLLEGE
480636041	KANSAS INDEPENDENT COLLEGE FOUNDATION
480666889	MENTAL HEALTH CENTER OF EAST CENTRAL KANSAS
480667209	KANSAS STATE UNIVERSITY FOUNDATION
480674479	MERCY REGIONAL HEALTH CENTER OF MANHATTAN AUXILIARY
480678363	SOUTH CENTRAL MENTAL HEALTH CENTER INC
480678906	SOUTHEAST KANSAS MENTAL HEALTH CENTER
480680117	UNIVERSITY OF KANSAS CENTER FOR RESEARCH INC
480680382	KANSAS LEARNING CENTER FOR HEALTH INC
480686630	HIGH PLAINS MENTAL HEALTH CENTER
480688389	HUTCHINSON COMMUNITY COLLEGE ENDOWMENT ASSOCIATION
480688453	KANSAS HEALTH CARE ASSOCIATION INC
480688802	CENTRAL KANSAS MENTAL HEALTH CENTER
480690737	WICHITA STATE UNIVERSITY UNION CORP
480691769	KANSAS BUILDING TRADES OPEN END HEALTH AND WELFARE FUND
480692681	MEDICAL SOCIETY OF JOHNSON AND WYANDOTTE COUNTIES
480695762	WICHITA STATE UNIVERSITY ALUMNI ASSOCIATION INC
480697159	FOUR COUNTY MENTAL HEALTH CENTER INC
480730326	VALEO BEHAVIORAL HEALTH CARE INC
480730814	MIDAMERICA NAZARENE UNIVERSITY
480735167	COWLEY COLLEGE FOUNDATION
480759236	INDEPENDENCE COMMUNITY COLLEGE FOUNDATION
480766794	KANSAS INDEPENDENT COLLEGE ASSOCIATION
480770308	KVC BEHAVIORAL HEALTHCARE INC
480771515	LAWRENCE MEMORIAL HOSPITAL ENDOWMENT ASSOCIATION
480775739	BERT NASH COMMUNITY HEALTH CENTER INC
480777079	BENEDICTINE COLLEGE
480779982	UNIVERSITY CHILD DEVELOPMENT INC
480805658	UNIVERSITY OF KANSAS SCHOOL OF MEDICINE- WICHITA MEDICAL PRACTICE ASSOCIATION
480813222	KANSAS FOUNDATION FOR MEDICAL CARE INC
480844843	KANSAS HEALTH CARE PROVIDER INC INSURANCE AVAILABILITY PLAN
480845355	MENTAL HEALTH CENTER OF EAST CENTRAL KANSAS ENDOWMENT ASSOCIATION
480846557	PAWNEE MENTAL HEALTH SERVICES INC
480847946	COMPREHENSIVE HEALTH OF PLANNED PARENT- HOOD GREAT PLAINS INC
480851998	APOSTOLIC FAITH CHURCH BIBLE C COLLEGE INC
480855426	HIGH PLAINS MENTAL HEALTH CENTER ENDOWMENT ASSOCIATION INC
480858197	SALINA HEALTH EDUCATION FOUNDATION
480862028	HOMESTEAD HEALTH CENTER INC
480862732	SUSAN B ALLEN MEMORIAL HOSPITAL FOUNDATION
480868859	FOUNDATION FOR SHAWNEE MISSION MEDICAL CENTER INC
480873431	KANSAS HEALTH FOUNDATION
480876205	ASSOCIATION OF COMMUNITY MENTAL HEALTH CENTERS OF KANSAS INC
480886411	LABETTE CENTER FOR MENTAL HEALTH SERVICES INC
480891435	HUTCHINSON REGIONAL MEDICAL FOUNDATION
480891620	MEDICAL SERVICE BUREAU INC
480908355	HUNTER HEALTH CLINIC
480908781	SOUTHWEST MEDICAL CENTER FOUNDATION
480909573	SPRING RIVER MENTAL HEALTH AND WELLNESS INC
480910226	KANSAS ASSOCIATION OF LOCAL HEALTH DEPARTMENTS
480919469	PAWNEE MENTAL HEALTH FOUNDATION
480926092	NEOSHO COUNTY COMMUNITY COLLEGE FOUNDATION
480934064	LAWRENCE PAPER COMPANY HEALTH AND WELFARE PLAN
480938377	PARSONS STATE HOSPITAL ENDOWNMENT ASSOCIATION
480938889	KANSAS UNIVERSITY NEUROLOGICAL FOUNDATION
480940011	KANZA MENTAL HEALTH AND GUIDANCE CENTER
480947391	KANSAS CITY KANSAS COMMUNITY COLLEGE FOUNDATION
480947732	LINDSBORG COMMUNITY HEALTH CARE FOUNDATION INC
480949407	SALINA REGIONAL HEALTH FOUNDATION
480952508	SHAWNEE MISSION HEALTH CARE INC
480952810	SOUTHWEST MEDICAL CENTER EMPLOYEE BENEFIT TRUST
480953164	KANSAS UNIVERSITY PSYCHIATRY FOUNDATION
480955489	RIVERBEND REGIONAL HEALTHCARE FOUNDATION
480957477	SABETHA COMMUNITY HEALTH FOUNDATION
480958384	AGRI-BUSINESS BENEFIT TRUST EMPLOYEE HEALTH CARE PLAN
480958587	NEWMAN REGIONAL HEALTH AUXILARY
480959892	J A PETERSON COMPANIES MEDICAL TRUST
480966856	CLOUD COUNTY FOUNDATION FOR HEALTH CARE INC
480970362	HORIZONS MENTAL HEALTH CENTER INC
480972107	HAYS MEDICAL CENTER INC HEALTH CARE BENEFITS TRUST
480973746	UNIVERSITY OF KANSAS DELTA CHI ASSOCIATION
480979239	NEMAHA COUNTY COMMUNITY HEALTH SERVICES
480979845	OLATHE HEALTH SYSTEM INC
480981990	COFFEYVILLE REGIONAL MEDICAL CENTER FOUNDATION
480985868	COMMUNITY HEALTH CENTER IN COWLEY COUNTY INC
480990763	MENTAL HEALTH ASSOCIATION OF SOUTH CENTRAL KANSAS INC
480996330	MIDAMERICA NAZARENE UNIVERSITY FOUNDATION
480998959	STEVENS COUNTY MEDICAL FOUNDATION
481009259	LABETTE HEALTH FOUNDATION INC
481023979	MORRIS COUNTY HOSPITAL FOUNDATION
481027133	DECATUR HEALTH CARE FOUNDATION INC
481030602	TREGO HOSPITAL ENDOWMENT FOUNDATION INC
481032245	KANSAS WESLEYAN UNIVERSITY FOUNDATION
481035296	CLAY COUNTY HOSPITAL FOUNDATION
481037201	MCPHERSON HOSPITAL INC EMPLOYEE GROUP BENEFIT TRUST
481039652	COFFEYVILLE COMMUNITY COLLEGE FOUNDATION
481043952	MCPHERSON HEALTHCARE FOUNDATION INC
481045423	GEARY COMMUNITY HEALTHCARE FOUNDATION INC
481055185	WICHITA CENTER FOR GRADUATE MEDICAL EDUCATION
481055555	MANHATTAN CHRISTIAN COLLEGE FOUNDATION
481060520	OVERLAND PARK MEDICAL STAFF DUES FUND
481062441	NORTH CENTRAL KANSAS HEALTH CARE FOUNDATION
481067637	HIGHLAND COMMUNITY COLLEGE FOUNDATION
481067727	GOVE COUNTY HEALTHCARE ENDOWMENT FOUNDATION INC
481067752	SOUTHWEST BOULEVARD FAMILY HEALTH CARE
481070398	PARSONS STATE HOSPITAL CHILD CARE
481072716	RIVERVIEW HEALTH SERVICES INC
481077073	MERCY HEALTH FOUNDATION FORT SCOTT
481077460	CLARA BARTON HOSPITAL FOUNDATION INC
481084624	WILLIAM NEWTON HOSPITAL EMPLOYEE GROUP BENEFIT TRUST
481088881	PRATT HEALTH FOUNDATION
481088982	OLATHE HEALTH PHYSICIANS INC
481091767	ROOKS COUNTY HEALTHCARE FOUNDATION
481091875	HEALTH MINISTRIES CLINIC INC
481092520	ST FRANCIS HEALTH CENTER FOUNDATION
481095749	RICE COMMUNITY HEALTHCARE FOUNDATION
481096498	MENTAL HEALTH ASSOCIATION RESIDENTIAL CARE INC
481097527	RANSOM MEMORIAL HOSPITAL CHARITABLE ASSOCIATION INC
481105296	EBAT FOR THE BLUE BEACON INTERNATIONAL INC MAJOR MEDICAL PLAN
481107363	STANION WHOLESALE ELECTRIC CO HEALTH CARE PLAN
481108830	UNIVERSITY OF KANSAS MEDICAL CENTER RESEARCH INSTITUTE
481114249	BETHANY COLLEGE TRUST
481115529	HEALTH PARTNERSHIP CLINIC INC
481119879	FREDONIA REGIONAL HEALTH CARE FOUNDATION INC
481134241	MITCHELL COUNTY COMMUNITY HOSPITAL ENDOWMENT FUND
481136010	OLATHE HEALTH CHARITABLE FOUNDATION
481140505	ANTHONY HOSPITAL AND CLINIC
481141020	CHOICES MEDICAL CLINIC INC
481141120	SEDAN AREA EMERGENCY MEDICAL SERVICE
481149398	KU HEALTHPARTNERS INC
481150706	KONZA PRAIRIE COMMUNITY HEALTH CENTER INC
481150841	KANSAS STATE UNIVERSITY INSTITUTE FOR COMMERCIALIZATION
481151382	TURNER HOUSE CHILDRENS CLINIC DBA VIBRANT HEALTH - WYANDOTTE NEIGHBO
481152279	MERCY COMMUNITY HEALTH FOUNDATION INC
481154675	SALINA REGIONAL HEALTH PROPERTIES INC
481155384	ELLSWORTH COUNTY HEALTH CARE FOUNDA
481156696	FLINT HILLS TECHNICAL COLLEGE FOUNDATION
481158262	CITIZENS MEDICAL CENTER EMPLOYEE BENEFIT PLAN
481159633	GRACEMED HEALTH CLINIC INC
481160123	SPECTRUM HEALTH FOUNDATION INC
481161455	LANDOLL CORPORATION HEALTHCARE PLAN
481163256	SUNFLOWER HEALTH NETWORK INC
481164712	DODGE CITY COMMUNITY COLLEGE FOUNDATION
481165405	HEART OF KANSAS FAMILY HEALTH CARE INC
481172107	ASCENSION VIA CHRISTI HEALTH INC FKA VIA CHRISTI HEALTH INC
481172394	UNIVERSITY OF KANSAS MEDICAL CENTER RESEARCH ROPERTIES INC
481179684	HAYS MEDICAL CENTER FOUNDATION
481180078	HEALTHCORE CLINIC INC
481183921	MENTAL HEALTH ASSOCIATION PINECREST PLACE INC
481185409	MENTAL HEALTH AMERICA OF THE HEARTLAND
481189520	KANSAS EMERGENCY MEDICAL SERVICES
481191364	COFFEY HEALTH FOUNDATION
481193556	FLINT HILLS COMMUNITY HEALTH CENTER INC
481194308	PROGRESSIVE HEALTHCARE ALLIANCE INC
481200868	CENTRAL PLAINS HEALTH CARE PARTNERSHIP INC
481206630	MEDICAL GAS PROFESSIONAL HEALTHCARE ORGANIZATION INC
481221800	HEARTLAND MEDICAL CLINIC INC
481223766	HIAWATHA COMMUNITY HOSPITAL FOUNDATION
481225436	SUNFLOWER HEALTH NETWORK SERVICES INC
481230936	NEWMAN HOSPITAL REGIONAL HEALTH FOUND DBA NEWMAN REGIONAL HEALTH FOUNDATION
481236589	VIA CHRISTI HEALTHCARE OUTREACH PROGRAM FOR ELDERS INC
481240823	L AND C HOME HEALTH AGENCY INC
481241590	SUNFLOWER FOUNDATION HEALTH CARE FOR KANSANS
481242654	SHAWNEE COUNTY MEDICAL SOCIETY FOUNDATION INC
481262832	HILL COUNTRY MISSION FOR HEALTH INC
481266277	SIGNATURE HEALTH CARE FOUNDATION
481289745	PORTNEUF HEALTH TRUST
481302204	CRESCENT COMMUNITY HEALTH CENTER
481305451	INDO-AMERICAN HEALTH AND EDUCATION FOUNDATION INC
486033927	UNIVERSITY OF KANSAS MEMORIAL CORPORATION
486088461	EMPORIA STATE UNIVERSITY FOUNDATION
486101212	COMPASS BEHAVIORAL HEALTH
486104332	PITTSBURG STATE UNIVERSITY FOUNDATION INC
486105561	WASHBURN UNIVERSITY FOUNDATION
486106237	KANSAS STATE UNIVERSITY RESEARCH FOUNDATION
486108086	FORT HAYS STATE UNIVERSITY FOUNDATION
486115674	FORT HAYS STATE UNIVERSITY ALUMNI ASSOCIATION INC
486117407	WICHITA MEDICAL RESEARCH AND EDUCATION FOUNDATION
486118132	ST JOHNS COLLEGE ALUMNI ASSOC INC
486119870	COLBY COMMUNITY COLLEGE ENDOWMENT FOUNDATION
486121167	WICHITA STATE UNIVERSITY FOUNDATION
486123855	BUTLER COMMUNITY COLLEGE FOUNDATION
486125946	IBEW LOCAL UNION 226 HEALTH AND WELFARE PLAN
486127146	PLUMBING AND PIPEFITTING IND HEALTH AND WELFARE FUND OF KS
486127349	ASSOCIATED COLLEGES OF CENTRAL KANSAS
486132945	BARTON COUNTY COMMUNITY COLLEGE FOUNDATION
486140456	GARDEN CITY COMMUNITY COLLEGE ENDOWMENT ASSOCIATION
486140517	STORMONT VAIL HEALTH AUXILIARY
486179687	CONSTRUCTION INDUSTRY OF KANSAS HEALTH AND WELFARE FUND
510061011	MEDICAL SOCIETY OF DELAWARE
510064334	CHRISTIANA CARE HOME HEALTH AND COMMUNITY SERVICES
510064335	WESLEY COLLEGE INC
510069000	MENTAL HEALTH ASSOCIATION IN DELAWARE INC
510076973	WOMENS AUXILIARY MILFORD MEMORIAL HOSPITAL
510106112	DELAWARE HEALTHCARE ASSOCIATION
510107088	WILMINGTON UNIVERSITY INC
510109163	AMERICAN COLLEGE OF ORGONOMY
510109178	GOLDEY-BEACOM COLLEGE INC
510115863	DELAWARE CHAPTER - AMERICAN ASSOCIATION OF UNIVERSITY PROFESSORS
510120256	NATIONAL ASSOCIATION OF CHILDRENS HOSPITALS AND RELATED INSTITUTIONS INC
510136406	MONTEREY COUNTY HOSPITALITY ASSOCIATION
510137187	FRIENDS OF UNIVERSITY OF WISCONSIN HOSPITAL AND CLINICS INC
510137745	AMMONOOSUC COMMUNITY HEALTH SERVICES INC
510138282	EASTERN AREA HEALTH EDUCATION CENTERINC
510138977	NEW HAMPSHIRE LIFE AND HEALTH INSURANCE GUARANTY ASSOCIATION
510140156	UNIVERSITY UNION OPERATION OF CALIFORNIA STATE UNIVERSITY SACRAMENTO
510141667	VICTOR VALLEY COLLEGE FOUNDATION
510141783	OPERATING ENGINEERS LOCAL 234 HEALTH AND WELFARE TRUST FUND
510142144	SAN FERNANDO COMMUNITY HOSPITAL
510145185	NORTHEAST COMMUNITY COLLEGE FOUNDATION
510146485	LORAIN COUNTY COMMUNITY COLLEGE FOUNDATION
510146615	UPPER KANAWHA HEALTH ASSOCIATION INC
510151490	BAKERSFIELD COLLEGE FOUNDATION
510151587	ALABAMA CHAPTER OF AMERICAN COLLEGE OF EMERGENCY PHYSICIANS INC
510151768	UNIVERSITY OF WISCONSIN-STEVENS POINT PAPER SCIENCE FOUNDATION INC
510152394	ANCHORAGE COMMUNITY MENTAL HEALTH SERVICES INC
