EIN	Name
730947945	NORTHWESTERN OKLAHOMA STATE UNIVERSITY FOUNDATION
730950060	PLUMBERS AND PIPEFITTERS LOCAL UNION NO 344 HEALTH AND WELFARE FUND
730955756	CENTRAL OKLAHOMA AMERICAN INDIAN HEALTH COUNCIL INC
730957262	ROGERS STATE UNIVERSITY FOUNDATION
730968231	EMERGENCY MEDICAL SERVICE
731006627	O R A EDUCATION FOUNDATION DBA OKLAHOMA HOSPITALITY FOUNDATION
731020684	OKLAHOMA STATE UNIVERSITY ALUMNI ASSOC
731020859	ADDICTION AND BEHAVIORAL HEALTH CENTER INC
731024870	SOUTHWESTERN OKLAHOMA STATE UNIVERSITY FOUNDATION INC
731031993	HEALTH OCCUPATIONS STUDENTS OF OKLA
731039733	GRAND LAKE MENTAL HEALTH CENTER INC
731042545	INDIAN HEALTH CARE RESOURCE CENTER INC
731047338	INTEGRIS HEALTH FOUNDATION INC
731068829	MERCY HEALTH CENTER AUXILIARY
731081013	BLUESTEM REGIONAL MEDICAL DEVELOPMENT FOUNDATION INC
731082189	CARL ALBERT STATE COLLEGE DEVEL FOUND
731084521	GREEN COUNTRY BEHAVIORAL HEALTH SERVICES INC
731095558	BAPTIST REGIONAL HEALTH CENTER FOUNDATION INC
731108774	CREOKS MENTAL HEALTH SERVICES
731127543	FAMILY HEALTHCARE CLINIC INC
731133139	ST JOHN HEALTH SYSTEM FOUNDATION INC
731134098	NORTH OKLAHOMA COUNTY MENTAL HEALTH CENTER
731137699	UNIVERSITY ECONOMIC DEVELOPMENT ASSOCIATION INC
731157305	OKLAHOMA LIFE AND HEALTH INSURANCE GUARANTY ASSOCIATION
731160358	OKLAHOMA VETERINARY MEDICAL ASSOCIATION
731161116	CLINTON REGIONAL HOSPITAL SVC VOL VOLUNTEERS INC
731173571	STILLWATER MEDICAL FOUNDATION INC
731177858	MORTON COMPREHENSIVE HEALTH SERVICES INC
731188521	AMERICAN-PORTUGUESE BIOMEDICAL RESEARCH FUND INC
731192764	INTEGRIS HEALTH INC
731200262	CHILDRENS MEDICAL RESEARCH INC
731203942	NORMAN REGIONAL HEALTH FOUNDATION
731209617	NORTHEASTERN OKLAHOMA AANDM COLLEGE DEVELOPMENT FOUNDATION INC
731215174	ST JOHN HEALTH SYSTEM INC
731223304	CENTRAL OKLAHOMA FAMILY MEDICAL CENTER INC
731227715	TULSA JEWISH COMMUNITY RETIREMENT AND HEALTH CARE CENTER INC
731228906	CUSHING REGIONAL HOSPITAL AUXILIARY
731234331	SAINT FRANCIS HOME HEALTH INC
731248786	KAISER-FRANCIS OIL COMPANY VOLUNTARY BENEFICIARY HEALTH TRUST
731260583	ST MARYS HOSPITAL VOLUNTEERS
731260588	MEDICAL CENTER VOLUNTEERS INC
731274465	ARKANSAS OSTEOPATHIC MEDICAL ASSOCIATION
731288960	BACONE COLLEGE DEVELOPMENT CORPORATION
731293682	SOUTHERN NAZARENE UNIVERSITY FOUNDATION
731320000	MUSKOGEE MEDICAL FOUNDATION
731323414	HOBBY LOBBY STORES INC MEDICAL AND DENTAL PLAN TRUST
731328882	LAUREATE MENTAL HEALTH CORPORATION
731345128	ROSE STATE COLLEGE FOUNDATION
731365933	OKLAHOMA COMMUNITY HEALTH CENTERS INC
731366971	UNIVERSITY OF SCIENCE AND ARTS OF OKLAHOMA ALUMNI ASSOCIATION INC
731386941	CHANDLER USA INC GRP MEDICAL PLAN TRUST TRUST
731393227	TULSA COUNTY MEDICAL SOCIETY FOUNDATION
731410736	RURAL HEALTH PROJECT INC
731411746	CUSHING REGIONAL HOSPITAL FOUNDATION
731424430	COMANCHE COUNTY MEMORIAL HOSPITAL FOUNDATION INC
731427611	THOMAS N LYNN INSTITUTE FOR HEALTHCARE RESEARCH INC
731445509	TULSA OSTEOPATHIC MEDICAL SOCIETY
731448926	SOUTH COLLEGE FOUNDATION CO BRUCE MACKELLAR
731453025	ASSISTANCE IN HEALTH CARE INC
731453048	MERCY HEALTH OKLAHOMA COMMUNITIES
731455422	MCCURTAIN MEMORIAL HOSPITAL FOUNDATION INC
731466459	PAULS VALLEY GENERAL HOSPITAL FOUNDATION INC
731481024	OKLAHOMA BEHAVIORAL HEALTH ASSOCIATION
731502192	STILLWATER COMMUNITY HEALTH CENTER
731520034	COMMUNITY HEALTH FOUNDATION OF PONCA CITY INC
731523469	FAMILY OF FAITH CHRISTIAN UNIVERSITY A CORPORATION
731529564	OKLAHOMA CITY COMMUNITY COLLEGE FOUNDATION
731537952	HEALTH OUTREACH PREVENTION EDUCATION INC
731551538	PARTNERSHIP FOR HEALTHY CENTRAL COMMUNITIES INC
731558213	SHIC INC ASIAN HEALTH SERVICES
731559561	GOOD SAMARITAN HEALTH SERVICES INC
731574488	MERCY MEMORIAL HEALTH CENTER AUXIL
731585868	PHILLIPS UNIVERSITY LEGACY FOUNDATION INC
731600133	UNIVERSITY CENTER AT PONCA CITY FOUNDATION INC
731608371	SHARE MEDICAL CENTER FOUNDATION
731618193	TAHLEQUAH HOSPITAL FOUNDATION INC
731618323	MCALESTER REGIONAL HEALTH CENTER FOUNDATION
731628231	FRED M VAN ECK FOREST FOUNDATION FOR PURDUE UNIVERSITY
731631545	ALLEN TEMPLE HEALTH AND SOCIAL SERVIC
731633096	CI UNIVERSITY AUXILIARY SERVICES INC
731635019	WORLDWIDE INSTITUTE OF MEDICAL EDUCATION
731640188	INTERNATIONAL FOUNDATION FOR NUTRITION AND HEALTH
731651475	HIGH COUNTRY BEHAVIORAL HEALTH
731663091	COMPLETE CARE COMMUNITY HEALTH CENTER
731664673	VALLEY VIEW HOSPITAL FOUNDATION
731668021	CASE NEW HOLLAND RETIREE MEDICAL SAVINGS ACCOUNT TRUST
731670436	AFRICAN FAMILY HEALTH ORGANIZATION
731679393	CALIFORNIA CENTRAL UNIVERSITY
731680114	FEDERATED UNIVERSITY POLICE OFFICERS ASSOCIATION
731681833	KOOLAULOA COMMUNITY HEALTH AND WELLNESS CENTER INCORPORATED
731719218	MADELIA COMMUNITY HOSPITAL FOUNDATION
731729007	SCAN HEALTH PLAN ARIZONA
736091755	UNIVERSITY OF OKLAHOMA FOUNDATION INC
736097060	OKLAHOMA STATE UNIVERSITY FOUNDATION
736097246	MU ALPHA THETA NATL HIGH SCHOOL AND TWO-YEAR COLLEGE MATH MU ALPHA THETA
736098212	UNIVERSITY OF CENTRAL OKLAHOMA ALUMNI ASSOCIATION
736104300	ST ANTHONY HOSPITAL FOUNDATION INC
736105494	MARSHALL COUNTY HOSPITAL FOUNDATION
736105712	JUNIOR HOSPITALITY CLUB INC
736105906	FOUNDERS OF DOCTORS HOSPITAL INC
736107046	NORMAN REGIONAL HEALTH SYSTEM AUXILIARY
736108032	UNIVERSITY OF CENTRAL OKLAHOMA FOUNDATION
736108721	DEACONESS HOSPITAL AUXILLARY
736108891	JAMES DENNIS MEDICAL FOUNDATION INC COMMUNITY HEALTH CENTER
736111618	OKLAHOMA MENTAL HEALTH COUNCIL
736229472	ACME ENGINEERING COMPREHENSIVE HEALTH CARE PROGRAM TRUST
736260532	MCCURTAIN COUNTY PUBLIC HEALTH MANAGEMENT AUTHORITY
736278945	TULSA FIREFIGHTERS HEALTH AND WELFARE PLAN
736362543	RETIREE MEDICAL TRUST FOR REGIONAL UNIVERSITY SYSTEM OF OKLAHOMA
740490865	ASSOCIATION OF FORMER STUDENTS OF TEXAS A AND M UNIVERSITY
740510530	BEXAR COUNTY MEDICAL LIBRARY ASSOCIATION
740531205	BRYAN-COLLEGE STATION CHAMBER OF COMMERCE
740693284	NORTH AMERICAN COLLEGES AND TEACHERS OF AGRICULTURE INC
740960070	UNIVERSITY CO-OPERATIVE SOCIETY
741030788	TEXAS MEDICAL CENTER
741043576	TRANSPORT WORKERS MTA HEALTH AND WELF
741078510	TEXAS MEDICAL ASSOCIATION
741109620	WILLIAM MARSH RICE UNIVERSITY
741109630	TEXAS BIOMEDICAL RESEARCH INSTITUTE
741109631	OUR LADY OF THE LAKE UNIVERSITY OF SAN ANTONIO
741109633	TRINITY UNIVERSITY
741109641	ST EDWARDS UNIVERSITY
741109661	UNIVERSITY OF THE INCARNATE WORD
741109748	TEXAS LUTHERAN UNIVERSITY
741143128	ST MARYS UNIVERSITY
741148423	HARRIS COUNTY MEDICAL SOCIETY
741159753	BAYLOR UNIVERSITY
741161940	UNIVERSITY OF MARY HARDIN-BAYLOR
741161941	CONCORDIA UNIVERSITY TEXAS
741180151	HUSTON-TILLOTSON UNIVERSITY
741185725	TEXAS A AND M UNIVERSITY 12TH MAN FOUNDATION
741193459	SCHREINER UNIVERSITY
741194288	TEXAS ASSOCIATION OF COLLEGE TEACHERS
741196134	MID-AMERICA CHRISTIAN UNIVERSITY INC
741224362	SANTA ROSA CHILDRENS HOSPITAL FOUNDATION
741233796	SOUTHWESTERN UNIVERSITY
741238438	PAUL QUINN COLLEGE
741246255	INSTITUTE OF SPIRITUALITY AND HEALTH AT THE TEXAS MEDICAL CENTER
741260701	AUXILIARY TO DRISCOLL CHILDRENS HOSPITAL
741260710	BCFS HEALTH AND HUMAN SERVICES
741272394	MENTAL HEALTH AMERICA OF GREATER HOUSTON INC
741277664	UNIVERSITY OF ST THOMAS
741279334	BELLVILLE HOSPITAL FOUNDATION
741279358	BEXAR COUNTY MEDICAL SOCIETY
741297210	RIVERSIDE GENERAL HOSPITAL CJSN BANKRUPTCY TRUSTEE
741301485	TEXAS HEALTH CREDIT UNION
741318727	CHI EPSILON INCORPORATED UNIVERSITY OF TEXAS AT ARLINGTON
741339050	WESLEY COLLEGE
741343044	UNIVERSITY MEDICAL BRANCH STUDENT BOOK STORE AND HOSPITALITY
741362741	TEXAS HOSPITAL ASSOCIATION
741366280	SAN ANTONIO MEDICAL FOUNDATION
741367041	UNIVERSITY OF HOUSTON ALUMNI ASSOCIATION FOUNDATION
741380141	TEXAS PODIATRIC MEDICAL ASSOCIATION CO KEN GREEN CPA PLLC
741400699	HOUSTON BAPTIST UNIVERSITY
741460204	WOMENS AND MENS HEALTH SERVICES OF THE COASTAL BEND INC
741473230	1ST UNIVERSITY CREDIT UNION
741473384	PUBLIC SERVICE HEALTH CLUB
741490000	BAYLOR MEDICAL FOUNDATION
741501841	UNIVERSITY OF TEXAS PHI ENDOWMENT FUND
741546619	GOODALL WITCHER HEALTHCARE FOUNDATION
741548089	COMMUNITY HEALTH CENTERS OF SOUTH CENTRAL TEXAS INC
741554976	SOUTH TEXAS COLLEGE OF LAW HOUSTON INC
741587488	UNIVERSITY OF TEXAS FOUNDATION INC
741613878	BAYLOR COLLEGE OF MEDICINE
741621269	ELECTRICAL MEDICAL TRUST
741623759	NUECES COUNTY MHMR COMMUNITY CENTER DBA NUECES CENTER FOR MENTAL HEALTH AND INTE
741648710	COLLEGE HOUSES INC
741685515	AMERICAN COLLEGE OF NURSE-MIDWIVES
741686904	SOUTHERN ASSOCIATION OF COLLEGES AND EMPLOYERS
741690467	BRYAN-COLLEGE STATION ASSOCIATION OF REALTORS
741700300	HOSPITALITY APARTMENTS
741712528	MEXICAN AMERICAN CATHOLIC COLLEGE INC
741715419	VIDA Y SALUD HEALTH SYSTEMS INC
741720086	TRAVIS COUNTY MEDICAL SOCIETY FOUNDATION
741724391	BARRIO COMPREHENSIVE FAMILY HEALTH CARE CENTER INC
741728621	SOUTH TEXAS FAMILY PLANNING AND HEALTH CORPORATION
741732551	UNIVERSITY OF HOUSTON LAW FOUNDATION
741747301	NOVA HEALTH SYSTEMS INC
741767441	TEXAS COMMUNITY COLLEGE TEACHERS ASSOCIATION
741769336	UNIVERSITY OF TEXAS SYSTEM MEDICAL FOUNDATION
741805266	TEXAS ASSOCIATION OF COMMUNITY COLLEGES
741815978	VANGUARD COLLEGE PREPARATORY SCHOOL
741826899	NATIONAL CENTER FOR FARMWORKER HEALTH INC
741850482	ARANSAS COUNTY MEDICAL SERVICES INC
741873453	MCLENNAN COUNTY MEDICAL EDUCATION AND RESEARCH FOUNDATION
741885205	HOUSTON COMMUNITY COLLEGE FOUNDATION
741894581	UCHEALTH NORTHERN COLORADO FOUNDATION
741905155	SHERIDAN COUNTY MEMORIAL HOSPITAL FOUNDATION
741905196	SOUTH TEXAS RURAL HEALTH SERVICES
741906005	CHRISTUS SPOHN HEALTH SYSTEM DEVELOPMENT FND
741912510	CYPRESS CREEK EMERGENCY MEDICAL SERVICES ASSOCIATION
741930998	CHI OMEGA FRATERNITY BAYLOR UNIVERSITY
741936078	WOMENS HEALTH AND FAMILY PLANNING ASSOCIATION OF TEXAS
741941775	CASSIE VOLUNTEER FIRE DEPARTMENT AND EMERGENCY MEDICAL SERVICES INC
741946138	TEXAS STATE UNIVERSITY SYSTEM FOUNDATION
741948396	METHODIST HOSPITAL SELF-INSURANCE TRUST
741951476	FORT BEND FAMILY HEALTH CENTER INC
741977996	UNIVERSITY OF TEXAS AT SAN ANTONIO ALUMNI ASSOCIATION
741979783	ARMY MEDICAL DEPARTMENT MUSEUM FOUNDATIO N INC
741982979	TEXAS STATE UNIVERSITY DEVELOPMENT FOUNDATION
741983485	TEXAS VETERINARY MEDICAL FOUNDATION
741987332	ALUMNI ASSOC OF THE UNIVERSITY OF TEXAS AT EL PASO
741993570	UNITED MEDICAL CENTERS
741994810	VICTORIA COLLEGE FOUNDATION INC
742001755	CULLEN TRUST FOR HEALTH CARE
742013710	WOMENS FUND FOR HEALTH EDUCATION AND RESEARCH
742016083	COLLEGE OF BIBLICAL STUDIES - HOUSTON
742020988	NATIONAL ASSOCIATION FOR MEDICAL DIRECTION OF RESPIRATORY CARE
742024841	CENTRAL EMERGENCY MEDICAL SERVICE INC
742027739	MISSION REGIONAL MEDICAL CENTER
742043456	TRI COUNTY EMERGENCY MEDICAL SERV
742044175	WESTERN COLORADO AREA HEALTH EDUCATION CENTER
742052197	SCOTT AND WHITE HEALTH PLAN
742077823	NORTH CHANNEL EMERGENCY MEDICAL SERVICES
742081983	AIM HOME HEALTH AGENCY INC
742089103	ATASCOSA HEALTH CENTERS
742094694	MARBLE FALLS AREA EMERGENCY MEDICAL SERVICE INC
742124519	HOSPICE AT THE TEXAS MEDICAL CENTER
742145984	ANGLETON AREA EMERGENCY MEDICAL CORPS INC
742156618	NORTHWEST COMMUNITY HEALTH
742176836	BROWNSVILLE COMMUNITY HEALTH CLINIC CORP
742182257	PIKES PEAK COMMUNITY COLLEGE FOUNDATION INC
742182919	MCKEE MEDICAL CENTER FOUNDATION
742200128	SHELL MEDICAL PLAN
742206098	ST DAVIDS COMMUNITY HEALTH FOUNDATION HOLDINGS
742232434	HEALTH SERVICE PROGRAMS INC
742237787	TEXAS HEALTH INSTITUTE
742243301	JUNIOR LEAGUE OF BRYAN COLLEGE STATION INCORPORATED
742246649	WALLS NEWSPAPERS CONSULTANTS EMPLOYEES MEDICAL PLAN TRUST
742246970	UNIVERSITY OF TEXAS RIO GRANDE VALLEY FOUNDATION
742255936	PLATTE VALLEY MEDICAL CENTER FOUNDATION
742257300	TEMPLE COLLEGE FOUNDATION INC
742259907	CENTRAL TEXAS MEDICAL CENTER FOUNDATION
742267667	SOUTHWEST REGIONAL EMERGENCY MEDICAL AND TRAUMA ADVISORY COUNCIL
742269704	UNIVERSITY OF WYOMING RESEARCH CORP
742269739	COMMUNITY HEALTH DEVELOPMENT INC
742272712	ST DAVIDS MEDICAL CENTER HEALTHCARE VOLUNTEERS
742275540	POWELL MEDICAL FOUNDATION
742277812	RESOURCE CENTER FOR PREGNANCY AND PERSONAL HEALTH
742281919	TEXAS UNITED METHODIST COLLEGE ASSOC CO SOUTHWESTERN UNIVERSITY
742286234	DEL MAR COLLEGE FOUNDATION INC
742301528	FLATIRON CONSTRUCTION CORP EMPLOYEE HEALTH BENEFIT TRUST
742308695	TEXAS ASSOCIATION OF COMMUNITY HEALTH CENTERS INC
742320730	BRYAN COLLEGE STATION APARTMENT ASSOCIATION
742320999	MEDICAL EDUCATION RESOURCES INC
742321009	HILLTOP HEALTH SERVICES CORPORATION
742335396	UNIVERSITY HEALTH SYSTEM FOUNDATION
742345414	COLORADO ASSOCIATION OF HOSPITAL ENGINEERING DIRECTORS INC
742353350	TEXAS MEDICAL INSTITUTE OF TECHNOLOGY
742355411	HONORHEALTH FOUNDATION
742357255	ROCKY MOUNTAIN CENTER FOR HEALTH PROMOTION AND EDUCATION
742358461	DRISCOLL CHILDRENS HOSPITAL DEVELOPMENT FOUNDATION INC
742370522	DUET PARTNERS IN HEALTH AND AGING INC
742371963	OGDEN-WEBER TECHNICAL COLLEGE FOUNDATION
742374809	SAVAGE COMPANIES CONSOLIDATED EMPLOYEES HEALTH CARE PLAN TRUST
742388735	KINGMAN REGIONAL MEDICAL CENTER FOUNDATION
742390346	SAN JUAN HEALTHCARE FOUNDATION INC CO MONTROSE MEMORIAL HOSPITAL
742393418	COLORADO MOUNTAIN COLLEGE FOUNDATION INC
742397671	BRAZOS MATERNAL AND CHILD HEALTH CLINIC
742410946	NORTHERN ARIZONA HEALTHCARE CORPORATION
742411016	ESTES PARK MEDICAL CENTER FOUNDATION
742412893	TEACHING HOSPITALS OF TEXAS
742412898	COMMUNITY HEALTH CENTERS INC
742418514	DIGNITY HEALTH FOUNDATION EAST VALLEY
742421549	PHOENIX CHILDRENS HOSPITAL FOUNDATION
742422589	ALAMO COLLEGES FOUNDATION INC
742426085	INNER CITY HEALTH CENTER
742427577	BIOMEDICAL RESEARCH FOUNDATION OF COLORADO
742428647	WEST UNIVERSITY SOFTBALL ASSOCIATION INC
742446170	SALVATION ARMY MEDICAL CARE TRUST
742446648	UTAH MEDICAL PRODUCTS INC EMPLOYEE WELFARE BENEFIT PLAN
742446651	FRIENDS OF THE TEXAS A AND M UNIVERSITY LIBRARIES
742448002	TEXAS ASSOCIATION OF HEALTH PLANS
742450217	SALIDA HOSPITAL FOUNDATION
742452969	NINE HEALTH SERVICES INC
742452971	EL PASO COMMUNITY COLLEGE FOUNDATION
742457919	BIENVIVIR SENIOR HEALTH SERVICES
742458061	WYOMING HEALTH FAIRS
742460290	RINCON UNIVERSITY MARCHING BAND ASSOCIATION
742461033	HANDS HEAD HEALTH OF UVALDE
742466103	HISPANIC ASSOCIATION OF COLLEGES AND UNIVERSITIES
742491445	TEXAS A AND M UNIVERSITY-CORPUS CHRISTI FOUNDATION INC
742499946	MENTAL HEALTH CENTER OF DENVER
742505662	VAIL HEALTH SERVICES FOUNDATION
742510587	EL PASO VETERINARY MEDICAL ASSOCIATION
742518531	TEXAS ASSOCIATION OF COMMUNITY HEALTH CENTERS PURCHASING GROUP
742521618	WICKENBURG COMMUNITY HOSPITAL FOUNDATION
742522436	FOUNDATION FOR ADVANCING VETERANS HEALTH RESEARCH
742539684	TEXAS ASSOC FOR COLLEGE ADMISSION COUNSELING INC
742540513	UNIVERSITY MEDICAL CENTER FOUNDATION OF EL PASO
742542417	BRYAN-COLLEGE STATION HABITAT FOR HUMANI
742544243	YORKTOWN EMERGENCY MEDICAL SERVICES
742548242	UVALDE EMERGENCY MEDICAL SERVICES INC
742550057	HANDS OF LUKE MEDICAL MINISTRIES
742550278	MCLENNAN COMMUNITY COLLEGE FOUNDATION ATTN KIM PATTERSON
742553409	GATEWAY COMMUNITY HEALTH CENTER INC
742557105	HILL COUNTRY MEMORIAL HOSPITAL FOUNDATION INC
742561471	MISSION HEALTH SERVICES
742567495	TEXAS ORGANIZATION OF RURAL AND COMMUNITY HOSPITALS
742570190	HILL COUNTRY MEDICAL MINISTRIES INC
742576856	COMMUNITY HOSPITAL FOUNDATION INC
742578952	ADVENTIST HEALTH SYSTEMTEXAS INC
742581806	BLINN COLLEGE FOUNDATION
742586154	CORPUS CHRISTI FIREFIGHTERS ASSOCIATION HEALTH AND BENEFITS TRUST
742587018	MEDICAL EYE AND DENTAL INTERNATIONAL CARE ORG INC
742594835	PTA UNIVERSITY PARK COLORADO CONGRESS
742614838	UTOPIA VOLUNTEER EMERGENCY MEDICAL SERVICES INC
742615186	TEXAS ASSOCFOR HEALTHPHYSICAL EDUCATION RECREATION AND DANCE
742624477	HEALTH FOR ALL INC
742627581	COLLEGE STATION ISD COUNCIL OF PARENT TEACHERS ORGANIZATIONS
742633918	CARDIOLOGY ASSOCIATES OF CORPUS CHRISTI MEDICAL HEALTH CARE PLAN TR
742639966	AUSTIN COMMUNITY COLLEGE FOUNDATION
742645518	WIMBERLEY EMERGENCY MEDICAL SERVICE SYSTEMS INC
742648885	BEHAVIORAL HEALTH SOLUTIONS OF SOUTH TEXAS
742649777	GUADALUPE REGIONAL MEDICAL FOUNDATION
742669281	SOCIAL AND HEALTH RESEARCH CENTER INC
742675605	INTERMOUNTAIN HEALTH CARE INC RETIREE WELFARE BENEFIT TRUST
742696970	PROVIDENCE HEALTH ALLIANCE
742716720	AREA HEALTH ED CNTR MID RIO GRANDE BORDER AREA OF TEXAS INC
742717368	ST LUKES LUTHERAN HEALTH MINISTRIES INC
742730187	BEXAR COUNTY MEDICAL SOCIETY FOUNDATION
742730350	HILLCREST FAMILY HEALTH CENTER
742749879	TEXAS MEDICAL ASSOCIATION SPECIAL FUNDS FOUNDATION
742752261	TEXAS HEALTHCARE TRUSTEES
742757309	MORRIS L LICHTENSTEIN JR MEDICAL RESEARCH FOUNDATION
742760152	UNIVERSITY PHYSICIANS GROUP
742761039	INTERNAL ASSOC OF HOSPITALITY ACCOUNTAN DBA HOSPITALITY FINANCIAL AND TECHNOLOGY
742765845	DEWITT MEDICAL FOUNDATION
742784427	LOWER RIO GRANDE VALLEY COMMUNITY HEALTH MANAGEMENT
742795943	ST MARKS MEDICAL CENTER FOUNDATION
742800601	DELL CHILDRENS MEDICAL GROUP
742803955	CAREER COLLEGES AND SCHOOLS OF TEXAS
742806531	SANTA ROSA FAMILY HEALTH CENTER
742809910	LIFE CHOICES MEDICAL CLINIC
742830002	KANSAS STATE UNIVERSITY GOLF COURSE MANAGEMENT AND RESEARCH FOUNDATION
742830626	KANSAS ASSOCIATION OF COMMUNITY COLLEGE TRUSTEES
742835828	NORTHERN NEW MEXICO COLLEGE FOUNDATION
742838488	DRISCOLL CHILDRENS HEALTH PLAN
742844558	MCKENNA HEALTH MANAGEMENT
742847917	MERCY AND TRUTH MEDICAL MISSIONS INC
742849118	CLOVIS COMMUNITY COLLEGE FOUNDATION
742851490	LUNA COMMUNITY COLLEGE FOUNDATION INC
742855426	EDWARD COUNTY EMERGENCY MEDICAL SERVICE INC
742865171	GEORGETOWN HEALTHCARE COMMUNITY SERVICES
742867580	HEART OF TEXAS COMMUNITY HEALTH CENTER INC
742869762	SETONUT DELL MEDICAL SCHOOL UNIVERSITY PHYSICIANS GROUP
742875896	HIGHLAND LAKES HEALTH FUND
742892751	MEDICAL CENTER ALLIANCE
742909634	COLLEGE STATION ISD EDUCATION FOUNDATION INC
742920954	COLLEGE OF PASTORAL SUPERVISION AND PSYCHOTHERAPY
742924512	HILLCREST HEALTH SYSTEM INC
742924613	CHILDRENS ENVIRONMENTAL HEALTH INSTITUTE INC
742929452	TEXAS HEALTH CARE ASSOCIATION EDUCATION FOUNDATION
742929471	ISLAND UNIVERSITY FOUNDATION TEXAS A AND M UNIVERSITY-CORPUS CHRISTI
742933060	CAMERON REGIONAL MEDICAL CNTR FOUNDATION
742945389	KNAPP MEDICAL CENTER AUXILIARYINC
742952209	TEXAS PODIATRIC MEDICAL FOUNDATION
742953076	BEXAR COUNTY COMMUNITY HEALTH COLLABORATIVE
742965534	SU CLINICA FAMILIAR MEDICAL FOUNDATION
742974908	TEXAS ASSOCIATION OF VOLUNTARY HOSPITALS
742981043	CENTRAL TEXAS HOSPITALITY HOUSE
742985906	SOUTH AUSTIN HOSPITAL AUXILIARY
742986045	CHEVRON PHILLIPS CHEMICAL CO LP HEALTH AND
742991996	COASTAL BEND COLLEGE FOUNDATION INC
742994337	CORP FOR THE DEVELOPMENT OF COMMUNITY HEALTH CENTERS
743001860	HEALTH EDUCATION AND LITERACY PROVIDERS INC
743002171	WYE RIVER GROUP ON HEALTHCARE
743002717	AUSTIN AREA MENTAL HEALTH CONSUMERS
743015783	LAND GRANT UNIVERSITY TAX EDUCATION FOUNDATION
743015812	TEJAS BEHAVIORAL HEALTH MANAGEMENT ASSOCIATION
743038926	BEHAVIORAL HEALTH ASSOCIATES
743050497	SOUTHWEST COMMUNITY HEALTH CENTER
743066798	SPRING ARBOR UNIVERSITY FOUNDATION
743083593	COMMUNITY HEALTH SYSTEMS INC
743083594	HEALTH SYSTEMS FACILITIES INC
743084989	ARIZONA DOMINICAN MEDICAL FRIENDS INC
743085118	FAITH MEDICAL MISSIONS INC
743095284	PROFESSIONAL BUSINESS COLLEGE INC
743096209	UNIVERSITY CITY PARTNERS
743121812	GADSDEN COMMUNITY HEALTH COUNCIL INC
743126038	CENTERS FOR CARE HEALTH PLAN CO BRONX FUNDING LLC
743130159	ST VINCENT WILLIAMSPORT HOSPITAL FOUNDATION INC
743146433	NEW MEXICO FOUNDATION FOR DENTAL HEALTH RESEARCH AND EDUCATION A PUBLIC CHARITY
743155412	MILLE LACS AREA HEALTH FOUNDATION
743173873	MELISSA MEMORIAL HOSPITAL CORPORATION
743195458	OUTDOOR BEHAVIORAL HEALTHCARE INDUSTRY COUNCIL
743205570	HOSPITAL QUALITY INSTITUTE
743226821	WEST VIRGINIA MEDICAL PROFESSIONALS HEALTH PROGRAM INC
743241990	MENTAL HEALTH HEROES
743249732	IDAHO HEALTH DATA EXCHANGE INC
746017762	TRAVIS COUNTY MEDICAL SOCIETY
746035267	BLUE BIRD AUXILIARY OF THE SOUTHWEST TEXAS METHODIST HOSPITAL
746035332	AUXILIARY TO MCALLEN MEDICAL CENTER
746038639	TEXAS IRON WORKERS HEALTH BENEFIT FUND
746041411	UNIVERSITY OF HOUSTON FOUNDATION
746046673	TEXAS HEALTH CARE ASSOCATION
746047760	ALPHA CHI NATIONAL COLLEGE HONOR SCHOLARSHIP SOCIETY
746050698	TEXAS MEDICAL ASSOCIATION ALLIANCE
746052242	ATASCOSA HOSPITAL ASSOCIATION
746052531	WEST UNIVERSITY LITTLE LEAGUE
746056794	UNIVERSITY OF TEXAS LAW SCHOOL FOUNDATION
746058233	TEXAS PUBLIC HEALTH ASSOCIATION
746060868	LAURA ELDRIDGE HOSPITAL ASSOCIATION 
746060886	KIWANIS CLUB OF COLLEGE STATIO K02572 COLLEGE STATION
746062205	TEXAS HEALTH INFORMATION MANAGEMENT ASSOCIATION
746062228	TEXAS ASSOCIATION OF LIFE AND HEALTH INSURERS
746062671	PHI CHI MEDICAL FRATERNITY ZETA CHAPTER
746062916	WHARTON CO JR COLLEGE FOUNDATION
746063269	AMERICAN VETERINARY MEDICAL ASSOCIATION TAMU STUDENT CHAPTER
746067257	TEXAS FOUNDATION FOR HEALTH PHYSICAL EDUCATION AND RECREATION
746073346	TEXAS MEDICAL ASSOCIATION FOUNDATION
746074210	CHRISTUS FOUNDATION FOR HEALTHCARE
746075997	TEXAS CARPENTERS AND MILLRIGHTS HEALTH AND WELFARE FUND
746082464	VOLUNTEER HEALTHCARE CLINIC INC
746104544	SOUTHWEST LABORERS HEALTH AND WELFARE FUND
746105635	LEE COLLEGE FOUNDATION INC
746106357	JOHN P MCGOVERN MUSEUM OF HEALTH AND MEDICAL SCIENCE
746132171	AMERICAN COLLEGE OF HEALTHCARE EXECUTIVE S-SOUTHEAST TEXAS CHAPTER INC
746188725	PLUMBERS AND PIPEFITTERS LU NO 286 PIPEFITTERS LU 286 HEALTH AND
746252674	TEXAS LIFE AND HEALTH INSURANCE GUARANTY ASSOCIATION
746296874	SCHLUMBERGER GROUP HEALTH CARE TRUST
746528872	KPMG LLP HEALTH PLANS TRUST
746559303	AZTEC WELL SERVICING COMPANY INC COMPANIES MEDICAL PLAN TRUST FUND
750121368	NEW MEXICO HIGHLANDS UNIVERSITY FOUNDATION INC
750223610	DALLAS COUNTY MEDICAL SOCIETY
750602145	TEXAS OSTEOPATHIC MEDICAL ASSOCIATION
750693870	TARRANT COUNTY MEDICAL SOCIETY
750800653	HOWARD PAYNE UNIVERSITY
750800679	TRUSTEES OF SHANNON WEST TEXAS MEMORIAL HOSPITAL
750800689	SOUTHERN METHODIST UNIVERSITY
750800691	TEXAS WESLEYAN UNIVERSITY
750808791	HARDIN-SIMMONS UNIVERSITY
750818183	WILEY COLLEGE
750827409	AUSTIN COLLEGE
750827465	TEXAS CHRISTIAN UNIVERSITY
750851900	ABILENE CHRISTIAN UNIVERSITY
750855633	MCMURRY UNIVERSITY
750855637	PTA UNIVERSITY PARK SCHOOL
750859668	WAYLAND BAPTIST UNIVERSITY
750859801	EAST TEXAS BAPTIST UNIVERSITY
750864040	WILSON N JONES MEMORIAL HOSPITAL
750864382	WOMENS AUXILIARY OF THE MEDICAL CENTER HOSPITAL
750869892	SMITH COUNTY MEDICAL SOCIETY
750879754	LILLIAN HUDSPETH MEMORIAL HOSPITAL RANCH LEASE
750891464	SOUTHWESTERN CHRISTIAN COLLEGE
750891465	SOUTHWESTERN ADVENTIST UNIVERSITY
750891475	SOUTHERN BIBLE INSTITUTE AND COLLEGE
750917417	TEXAS COLLEGE
750926755	UNIVERSITY OF DALLAS
750945939	SOUTHWESTERN MEDICAL FOUNDATION
750950119	LUBBOCK CHRISTIAN UNIVERSITY
750954755	MIDWESTERN STATE UNIVERSITY CREDIT UNION
750954859	WEST TEXAS AANDM UNIVERSITY ALUMNI ASSOCIATION
750957351	JACKSONVILLE COLLEGE
750968315	LUBBOCK CHILDRENS HEALTH CLINIC
750983821	ARLINGTON BAPTIST UNIVERSITY
750983834	MENTAL HEALTH AMERICA OF GREATER TARRANT COUNTY
750995027	JARVIS CHRISTIAN COLLEGE
750999935	MENTAL HEALTH AMERICA OF GREATER DALLAS
751041154	GOOD SHEPHERD HOSPITAL INC
751058426	BAYLOR HEALTH CARE SYSTEM CREDIT UNION
751077608	ARLINGTON MEMORIAL HOSPITAL AUXILIARY
751081109	LETOURNEAU UNIVERSITY
751092490	FEDERATION OF STATE MEDICAL BOARDS OF THE UNITED STATES INC
751104546	PIERCE MORTUARY COLLEGES INC
751162835	VOLUNTEER SERVICES COUNCIL FOR THE NORTH TEXAS STATE HOSPITAL
751220726	MEDICAL CENTER HEALTH SYSTEM FOUNDATION
751241868	TEXAS ASSOCIATION OF DEVELOPING COLLEGES INC
751249646	METRO MEDICAL CREDIT UNION
751254380	DALLAS-FORT WORTH HOSPITAL COUNCIL
751285930	INDEPENDENT COLLEGES AND UNIVERSITIES OF TEXAS INC
751292762	TEXAS WOMANS UNIVERSITY FOUNDATION INC
751338668	TEXAS HEALTH RESOURCES CREDIT UNION
751385179	COLLEGE HILLS SWIM AND RACQUET CLUB
751393366	UNIVERSITY OF TEXAS AT TYLER FOUNDATION
751414940	REGENCE HEALTH NETWORK
751494062	STEPHEN F AUSTIN STATE UNIVERSITY FOUNDATION INC
751525282	HILL COLLEGE FOUNDATION
751528614	COMMUNITY HEALTH SERVICE AGENCY INC
751548343	DALLAS METHODIST HOSPITALS FOUNDATION INC
751558672	NORTH BLANCO COUNTY EMS
751570933	IRVING HEALTHCARE FOUNDATION
751578067	TEXAS SOCIETY OF HEALTH-SYSTEM PHARMACISTS RESEARCH AND EDUCATION FNDN
751578415	HARRINGTON CANCER AND HEALTH FOUNDATION
751581287	SHANNON WEST TEXAS MEMORIAL HOSPITAL AUXILIARY INC
751585285	ANGELO STATE UNIVERSITY FOUNDATION INC
751589245	DALLAS COMMUNITY COLLEGE FACULTY ASSOCIATION INC
751593084	WEATHERFORD COLLEGE FOUNDATION INC
751596658	PARKER UNIVERSITY
751606705	BAYLOR HEALTH CARE SYSTEM FOUNDATION
751620540	ANGELO STATE UNIVERSITY EX-STUDENTS
751623068	STEPHEN F AUSTIN STATE UNIVERSITY ALUMNI ASSOCIATION INC
751658292	ANGELO STATE UNIVERSITY ROBERT G CARR A FOUNDATION
751662084	PARKLAND HEALTH AND HOSPITAL SYSTEM AUXILIARY
751664577	CONSOLIDATED MEDICAL DISABILITY AND LIFE TRUST
751665618	SOUTH PLAINS COLLEGE FOUNDATION
751666000	LIFENET COMMUNITY BEHAVIORAL HEALTHCARE
751669421	TEXAS PIPE TRADES HEALTH BENEFIT PLAN
751734749	TI EMPLOYEES HEALTH BENEFIT TRUST
751765603	FRANK PHILLIPS COLLEGE DEVELOPMENT CORPORATION
751781905	UNIVERSITY UNITED METHODIST CHURCH OF FORT WORTH FOUNDATION
751786007	AMBERTON UNIVERSITY
751788520	METHODIST RICHARDSON MEDICAL CENTER FOUNDATION INC
751789321	WESTERN TEXAS COLLEGE FOUNDATION
751812652	BAYLOR HEALTH CARE SYSTEM
751823660	DENTAL HEALTH PROGRAMS INC
751823808	AMERICAN COLLEGE OF PHYSICIANS TEXAS CHAPTER
751842956	TEXOMA HEALTH FOUNDATION
751848557	BAYLOR HEALTH CARE SYSTEM EMPLOYEE BENEFIT TRUST
751858993	BAPTISTST ANTHONYS HEALTH SYSTEM
751910600	PRESBYTERIAN MEDICAL CARE MISSION
751919144	PECAN PLANTATION VOLUNTEER FIRE DEPT AND EMERGENCY MEDICAL SERVICE INC
751924594	DFW BUSINESS GROUP ON HEALTH
751947007	ALL SAINTS HEALTH FOUNDATION
751993603	COVENANT MEDICAL CENTER AUXILIARY
752005249	ADULT DAY ACTIVITY AND HEALTH CENTER INC
752006921	NORTH CENTRAL TEXAS COLLEGE FDN INC
752008835	NORTHEAST TEXAS COMMUNITY COLLEGE FOUNDATION INC
752009162	COALITION OF HEALTH SERVICES INC
752012206	HEALTHY FAMILIES SAN ANGELO
752022128	TEXAS HEALTH RESOURCES FOUNDATION
752027157	GOOD SHEPHERD HEALTH SYSTEM INC
752045268	VERNON COLLEGE FOUNDATION INCORPORATED
