EIN	Name
272783321	COLLEGE PREPARATORY MIDDLE SCHOOL
272789189	GRACE CENTER FOR MATERNAL AND WOMENS HEALTH INC
272793072	UNIVERSITY CENTER OF GREENVILLE
272795242	DELTA CHI - UNIVERSITY OF ALABAMA CHAPTER HOUSE CORPORATION
272800837	SENIOR CARE NETWORK BENEFITS TRUST GROUP HEALTH PLAN
272825325	HEALTHY SCHOOLS INTERNATIONAL INC
272843521	SOUTH NASSAU COMMUNITIES HOSPITAL
272854711	HIGH POINT REGIONAL HEALTH FOUNDATION
272865454	GOOSE LAKE MEDICAL SERVICES INC
272881079	MATTAPAN HEALTH CENTER REALTY INC CO MATTAPAN COMMUNITY HEALTH CENTER INC
272883394	MISSOURI COMMUNITY HEALTH FOUNDATION INC
272884568	CENTER FOR IMPROVING VALUE IN HEALTH CARE
272912448	UNIVERSITY OF SAINT KATHERINE
272916353	LAMOUR COMMUNITY HEALTH INSTITUTE
272918042	VIRGINIA BAPTIST COLLEGE
272920745	HOUSTON HEALTH FOUNDATION
272933693	UVALDE HEALTHCARE FOUNDATION DBA KATE MARMION RIDES TO RADIATION
272953865	GARY AND MARY WEST HEALTH ENDOWMENTINC
272962753	BOLTON EMERGENCY MEDICAL SERVICES INC
272970837	BRICK TOWNSHIP VOLUNTEER EMERGENCY MEDICAL SERVICES INC
273001041	WISCONSIN INSTITUTE FOR HEALTHY AGING INC
273002117	ETERNITY BIBLE COLLEGE
273026474	WHITTIER STREET HEALTH CENTER REALTY CORPORATION
273033445	HIGH COUNTRY COMMUNITY HEALTH INC
273041119	CENTER FOR HEALTHCARE INNOVATION
273045436	CALIFORNIA TELEHEALTH NETWORK
273045878	CACI INTERNATIONAL INC HEALTH BENEFITS
273046997	MARILLAC COMMUNITY HEALTH CENTERS
273113428	BIGHORN VALLEY HEALTH CENTER INC
273126126	OAKSTONE HEALTH CENTER
273133200	GLOBAL TO LOCAL HEALTH INITIATIVE
273148590	BATTLE GROUND HEALTH CARE
273150223	PREFERRED CHOICE HEALTHCARE INC
273164934	BANYAN COMMUNITY HEALTH CENTER INC
273165657	MOTHER HEALTH INTERNATIONAL
273171530	SLATER HEALTH CARE FACILITIES
273177378	CENTER FOR RURAL HEALTH INNOVATION
273183285	JOPLIN REGIONAL MEDICAL SCHOOL ALLIANCE
273188239	NEIGHBORHOOD OUTREACH ACCESS TO HEALTH
273194544	GEORGIA DENTAL ASSOCIATION FOUNDATION FOR ORAL HEALTH INC
273202756	CAPE CORAL PROFFIREFIGHTERS HEALTH HEALTH TRUST
273214294	LOUISIANA ASSOCIATION FOR HEALTH PHYSICAL EDUCATION RECREATION AND DANCE
273220767	HEALTHCARE COLLABORATIVE
273250333	ONE PATIENT - GLOBAL HEALTH INITIATIVE LTD
273261289	BARTZ-ALTADONNA COMMUNITY HEALTH CENTER
273261652	DURABLE MEDICAL EQUIPMENT AID SOCIETY
273266672	MISSOURI ASSOCIATION FOR COLLEGE ADMISSION COUNSELING INC
273282543	MISSOURI HEALTH CONNECTION
273298736	COVENANT COLLEGE FOUNDATION INC
273319849	MEDICAL STAFF OF ALTA BATES MEDICAL CENTER
273321328	MONTICELLO COLLEGE INC
273326766	JERSEY HEALTH CONNECT
273339369	REMINGTON COLLEGE
273348917	RIDGE HEALTH SERVICES INC
273360465	GREATER HOUSTON HEALTHCONNECT
273394360	WOMEN AND CHILDREN HEALTH
273406573	KIDS COMMUNITY COLLEGE CHARTER SCHOOL ORANGE COUNTY INC
273427399	BOOTHEEL NETWORK FOR HEALTH IMPROVEMENT
273427721	UNIVERSITY OF NORTH CAROLINA ORTHODONTIC ALUMNI ASSOCIATION INC
273469483	SHANDS LAKE SHORE REGIONAL MEDICAL CENTER AUXILIARY INC
273488964	ETHIOPIA HEALTH AID INC
273495545	COLLEGES OF LAW LEGACY CORPORATION
273507116	CHARACTERHEALTH CORPORATION
273510935	GARY MIDDLE COLLEGE INC
273513154	SCOTT AND WHITE HEALTHCARE FOUNDATION
273524752	NEIGHBORHOOD HEALTH CENTER
273528076	ASSOCIATION OF COLLEGE AND UNIVERSITY PRINTERS INC
273533027	INDIANA UNIVERSITY HEALTH MORGAN INC
273546373	MOUNT CARMEL HEALTH WELLNESS AND COMMUNITY CENTER
273566344	ADVENTIST HEALTH POLICY ASSOCIATION INC
273590464	GEORGIA ASSOCIATION FOR HEALTH PHYSICAL EDUCA
273600575	MUNSON MEDICAL GROUP
273605364	CAHABA MEDICAL CARE FOUNDATION
273606960	SANCTA FAMILIA MEDICAL ASSOCIATES INC
273618164	PENNYROYAL HEALTH CARE SERVICES
273631987	AMERICAN FRIENDS OF RABBINICAL COLLEGE NETIV HADAAT INC
273645560	UNIVERSITY OF LOUISVILLE PHYSICIANS INC
273645742	EQUALHEALTH INC
273649987	ISRAEL HEALTHCARE FOUNDATION INC
273651366	CHAN SOON-SHIONG NANTHEALTH FOUNDATION FKA CHAN SOON-SHIONG INSTITUTE FOR ADV HLTH
273655320	CAHP RETIRED EMPLOYEES MEDICAL TRUST
273662468	COMMUNITY HEALTH AND EMPOWERMENT THROUGH EDUCATION AND RESEARCH
273663856	AFRICAN MISSION HEALTHCARE FOUNDATION
273664986	COMMUNITY HEALTH CENTER OF NORTHEAST OKLAHOMA
273672239	ISABELLA CITIZENS FOR HEALTH INC
273695360	PARCARE COMMUNITY HEALTH NETWORK INC
273742357	PTC ALLIANCE UNION RETIREE HEALTH BENEFITS TRUST
273764078	LTP MEDICAL MOBILE INC
273769602	CARBON VALLEY HEALTHCARE HOLDINGS CORPORATION
273795179	BERKS COMMUNITY HEALTH CENTER
273795985	EAST INDIANA AREA HEALTH EDUCATION CENTER
273832515	CORNERSTONE MEDICAL SERVICES FOUNDATION
273835905	COMPASS COOPERATIVE MUTUAL HEALTH NETWORK INC
273845241	MENTAL HEALTH GRACE ALLIANCE
273846820	KSB HOSPITAL VEBA HEALTH SAVINGS TRUST
273853231	FLORIDA KEYS COLLEGE CAMPUS FOUNDATION INC
273856741	LIFESPRING COMMUNITY HEALTH
273866474	KALISPELL REGIONAL MEDICAL CENTER VOLUNT
273871301	MICHIGAN HEALTH INFORMATION NETWORK SHARED SERVICES
273885910	MISSOURI HEALTH CARE FOR ALL
273893817	GOOD SAMARITAN HOSPITAL FREE CLINIC
273899821	ST JOSEPHS MEDICAL PC
273902914	CIRCLE HEALTH PHYSICIANS INC
273912808	SEWARD COMMUNITY HEALTH CENTER INC
273923442	REGIONAL EMERGENCY MEDICAL SERVICES AUTHORITY
273939616	UNIVERSITY OF ORANGE A NJ NONPROFIT CORPORATION
273943168	FAMILY HEALTH CARE ASSOCIATES OF KENTUCKY INC
273957752	NORTH SHORE-LIJ MEDICAL GROUP AT SYOSSET PC
273960910	JEWISH HOME LIFECARE UNIVERSITY AVENUE ASSISTED LIVING INC
273971570	WELLNESS PLAN MEDICAL CENTERS FOUNDATION
273988336	TJ REGIONAL HEALTH INC
273988456	TJ HEALTH PARTNERS LLC
274003392	AMERICAN COLLEGE OF MEDICAL SCRIBE SPECIALISTS A NEW JERSEY NON-PROFIT CORPORATION
274082359	VIRGINIA ORAL HEALTH COALITION INC
274098473	AMERICAN MEDICAL HOSPITAL OF SYRIA
274111915	GLOBAL MEDICAL TRAINING GMT
274127041	CLEMSON UNIVERSITY LAND STEWARDSHIP FOUNDATION INC
274133957	ADVANCED MEDICAL TRANSPORT OF IOWA
274144492	MISSION HAITI MEDICAL INC CO MARK W FULTON PRESIDENT
274160006	ELLWOOD CITY COMMUNITY HEALTH FOUNDATION
274168011	EAST ALABAMA MEDICAL CENTER VOLUNTARY EMPLOYEE BENEFICIARY ASSOCIATION TRUST
274181529	HARLEM MEDICAL ASSOCIATES PC
274198722	ALL INCLUSIVE COMMUNITY HEALTH CENT
274236054	MERCY SENIOR HEALTH SERVICES
274269892	WAVE COLLEGE INC
274271742	SOUTH CALIF PIPE TRADES PENSIONERS AND SURVIVING SPOUSES HEALTH FUND
274272183	MISSISSIPPI ROADMAP TO HEALTH EQUITY
274344294	WISCONSIN STATEWIDE HEALTH INFORMATION NETWORK INC
274347681	HEALTHY TO OUR KIDS INC
274358184	WALDORF LUTHERAN COLLEGE FOUNDATION INC
274364320	PHYSICIANS SCIENTISTS AND ENGINEERS FOR HEALTHY ENERGY
274379277	ASSOCIATION FOR THE ADVANCEMENT OF MEDICAL INSTRUMENTATION INC
274380115	CVS HEALTH EMPLOYEE RELIEF FUND
274384049	NORTH SHORE-LIJ MEDICAL GROUP AT HUNTINGTON P
274384146	NORTH SHORE-LIJ MEDICAL GROUP AT NORTH NASSAU
274385692	AVITA HEALTH SYSTEM
274395855	AMERICAN COLLEGE OF TRUST AND ESTATE COUNSEL
274411485	AMALGAMATED NATIONAL HEALTH FUND
274411487	HEALTHBRIDGE GLOBAL
274414937	OREGON HEALTH CARE INTERPRETERS ASSOC
274416017	PHELPS MEDICAL SERVICES PC
274417052	DELTA DENTAL OF OKLAHOMA ORAL HEALTH FOUNDATION
274435382	MERCY MEDICAL CENTER OF CAMBODIA INC
274437508	KANSAS HEALTH INFORMATION NETWORK INC
274444729	AGGIE ATHLETIC FOUNDATION OF NORTH CAROLINA A AND T STATE UNIVERSITY INC
274454855	COMMUNITY HEALTH BEST PRACTICES LLC
274481866	PASO DEL NORTE HEALTH INFORMATION EXCHANGE
274495703	UNIVERSITY OF QUEENSLAND IN AMERICA INC
274511973	ST BERNARD HOSPITAL FOUNDATION INC
274520226	NORTH COAST HEALTH IMPROVEMENT AND INFORMATION NETWORK INC
274536530	COMMISSION ON ACCREDITATION FOR HEALTH INFORMATICS AND INFO MGMT EDUCATION
274542683	UNIVERSITY OF SCIENCE AND TECHNOLOGY OF CHINA INITIATIVE FOUNDATION
274548522	ANDERSON HOSPITAL FOUNDATION
274557052	KENTUCKY VOICES FOR HEALTH INC
274584911	ASCENDING TO HEALTH RESPITE CARE INC
274592137	GEORGIA PROFESSIONAL HEALTH PROGRAM
274616751	BRUNSWICK NOVANT MEDICAL CENTER FOUNDATION
274620164	AMERICAN ACADEMY FOR ORAL SYSTEMIC HEALTH CORP
274628678	DOMINICAN MEDICAL-DENTAL COMMUNITY OUTREACH SOCIETY INC
274640248	LUTHERAN LIFE VILLAGES HOME HEALTHCARE INC
274645523	SAINT PETERS HEALTHCARE SYSTEM PHYSICIAN ASSOCIATES PC
274682873	FOUNDATION FOR EXCELLENCE IN MENTAL HEALTH CARE INC
274684465	CHILDRENS HOSPITALS NEONATAL CONSORTIUM
274698903	FAYETTEVILLE STATE UNIVERSITY STUDENT HOUSING CORPORATION
274700010	NH-ISAC INC
274743848	TRI-COUNTY HEALTH NETWORK
274744637	NCIAP MEDICAL CARE INC
274749421	TAMPA GENERAL MEDICAL GROUP INC
274803222	CITY OF HOPE MEDICAL FOUNDATION
274812632	CENTRAL ILLINOIS HEALTH INFORMATION EXCHANGE
274832756	WEST VIRGINIA RURAL HEALTH ASSOCIATION INC
274836619	UPMC MCKEESPORT MEDICAL STAFF FUND
274847846	NURSING RETIREE HEALTH FUND 
274862807	UNIVERSITY OF CLEVELAND PREPARATORY SCHOOL
274896758	CHARTER OAK HEALTH CENTER REALTY CORPORATION
274897270	MINNEWASKA AREA VEBA HEALTH SAVINGS TRUST
274971017	CORNELIA HOSPITALITY AND TOURISM BOARD INC
275006096	PEER 2 PEER UNIVERSITY INC
275024342	AMERICAN COLLEGE OF TRUST AND ESTATE COUNSEL FOUNDATION
275034344	MTM RETIREE HEALTH CARE PLAN AND TRUST
275078246	NORTH SHORE-LIJ MEDICAL GROUP URGENT MEDICAL CARE PC
275078717	NORTH SHORE- LIJ CARDIOVASCULAR MEDICINE PC DBA ORLIN AND COHEN MEDICAL SPECIALISTS GROUP
275079693	LAKES REGIONAL HEALTHCARE FOUNDATION
275158323	CHAPTERS HEALTH HOME CONNECT INC
275247081	FINNEY COUNTY COMMUNITY HEALTH COALITION INC
275273404	MJHS MEDICAL ASSOCIATES PC
275290658	ROCKY MOUNTAIN COLLEGE OF ART AND DESIGN FOUNDATION INC
275313022	VIRGINIA COLLEGE OF OPTOMETRY
275349262	DISTRICT HOSPITAL LEADERSHIP FORUM
275457632	NORTH CAROLINIANS FOR AFFORDABLE HEALTHCARE INC
275459970	BROOKLYN HOSPITAL WOMENS HEALTHCARE MEDICAL PROVIDERS PC
275537863	ALLAMA IQBAL MEDICAL COLLEGE ALUMNI ASSOC OF NORTH AMERICA INC
276021955	ATU 1577 SUPPLEMENTAL HEALTH INSURANCE
276030717	ONEOK INC EMPLOYEES RETIREE MEDICAL TRUST II
276100284	CTNA NONUSW HOURLY RETIREE HEALTH CARE TRUST
276102475	EMPLOYEE STOCK OWNERSHIP PLAN OF SELECT HEALTH CARE INC TRUST
276135515	UDW AFSCME 3930 SAN DIEGO HEALTH AND BENEFITS TRUST FUND
276204864	CALIFORNIA EMPLOYERS HEALTHCARE ALLIANCE TRUST
276217765	KETTLER HEALTH CARE PLAN
276239920	RETIREES OF ANCHOR ACQUISITION LLC HEALTH CARE TRUST
276606705	WASHINGTON AND LEE UNIVERSITY RETIREE
276763813	EMPLOYEE HEALTH AND WELFARE BENEFIT PLAN TRUST
276820275	KRAFT HEINZ COMPANY RETIREE HEALTH AND WELFARE BENEFITS TRUST III
276836409	DYNCORP INTERNATIONAL LLC HEALTH AND WELFARE PLAN
276838771	OMNITRADE HEALTH TRUST
276888869	STERLING MEDICAL CORPORATION EMPLOYEE BENEFIT TRUST
276922061	SHARYLAND UTILITIES RETIREE HEALTH
300002072	WV-OH SUPPLEMENTAL HEALTH PLAN
300017808	VIP COMMUNITY MENTAL HEALTH CENTER INC
300023422	UNIVERSITY OF TOLEDO FOUNDATION REAL ESTATE CORP
300030106	MERIDIAN HEALTH SYSTEM ASSISTANCE CORPORATION
300037158	GEORGIA SOUTHERN UNIVERSITY HOUSING FOUNDATION INC
300037857	VENTURE STRATEGIES FOR HEALTH AND DEVELOPMENT
300038860	LONE STAR COMMUNITY HEALTH CENTER
300042070	COMMUNITY HEALTH CLINIC INC
300051514	FLORIDA PUBLIC HEALTH INSTITUTE INC
300052569	PEMBINA COUNTY MEMORIAL HOSPITAL FDTN
300072620	HOLLAND FREE HEALTH CLINIC
300078108	RAMBAM HEALTH CORPORATION
300080150	COMMUNITY SERVICE ORGANIZATION BEHAVIORAL HEALTH PROGRAM
300086426	MERCY AND UNITY HOSPITALS FOUNDATION
300086728	PHYSICIANS MEDICAL FORUM
300088171	NORTH CENTRAL ILLINOIS LABORERS HEALTH AND WELFARE FUND
300089368	VALLEY CITY EDUCATION HEALTH AND SAFETY FUND INC
300099346	GALWAY UNIVERSITY FOUNDATION INC
300102842	FLOATING HOSPITAL FOUNDATION INC
300110891	ALUMNI OF UNIVERSITY OF OTAGO IN AMERICA CO JOHN CROWE
300126886	CHICAGO MEDICAL SOCIETY
300127648	FRIENDSHIP MEDICAL CLINIC INC
300128207	NORTHERN VIRGINIA HOSPITAL ALLIANCE
300130804	PALM BEACH COUNTY MEDICAL SOCIETY OF FL INC
300130880	CHRISTINA G SMITH COMMUNITY MENTAL HEALTH FOUNDATION INC
300144282	COSSATOT COMMUNITY COLLEGE OF THE UNIVERSITY OF ARKANSAS FOUNDATION
300156239	BE HEALTHY INC
300159769	SENIOR HOSPITALITY CORP
300170683	NEW YORK STATE ASSOCIATION FOR COLLEGE ADMISSION COUNSELING INC
300176646	ONONDAGA COMMUNITY COLLEGE HOUSING DEVELOPMENT CORPORATION
300177624	NORTHWEST BEHAVIORAL HEALTH PARTNERSHIP INC
300186796	HEALTH FIRST - AMERICAS CHARITIES
300186863	HEALTH POLICY INSTITUTE OF OHIO
300187514	SPRING CREEK HEALTH COOPERATIVE
300194688	ASSOCIATION OF ACCREDITED NATUROPATHIC MEDICAL COLLEGES
300198705	SPRING BRANCH COMMUNITY HEALTH CENTER
300206692	WAHIAWA HEALTH CARE SERVICES FOUNDATION
300209772	NORTHEAST ALABAMA COMMUNITY COLLEGE FOUNDATION
300212507	FRIENDS OF THE UNIVERSITY OF SURREY
300213137	BIO VENTURES FOR GLOBAL HEALTH
300213606	UNIVERSITY OF CANTERBURY FOUNDATION IN AMERICA INC
300217152	LOCAL 99 HEALTH AND WELFARE FUND
300219424	FAUQUIER HEALTH FOUNDATION DBA THE PATH FOUNDATION
300221189	STILLWATER HEALTH SYSTEM
300224028	TRAVERSE HEALTH CLINIC AND COALITION
300224279	INSULATORS LOCAL 84 HEALTH CARE PLAN
300225826	UNITED COMMUNITY HEALTH CENTER
300232645	FRIENDS OF ST LOUIS UNIVERSITY LIVER CENTER
300247776	LA GRANGE MEMORIAL HOSPITAL FOUNDATION
300249090	CHRISTIAN MEDICAL MINSTRY TO CAMBODIA JEREMIAHS HOPE
300262455	COLLEGE APPLICATION EDUCATION PROJECT INC
300272104	HEALTHY NEIGHBORHOODS INC
300275867	DENTAL HEALTH WORKS OF CHESHIRE COUNTY INC
300281587	WESTERN WAYNE FAMILY HEALTH CENTERS
300299005	WEST PALM BEACH PBA RETIREE HEALTH BENEFIT FUND
300305504	AMERICAN COLLEGE OF SURGEONS FOUNDATION
300329769	HEALTH PROFESSIONALS OF HOLMES COUNTY INC
300345964	MOBILE MEDICAL DISASTER RELIEF INC
300349221	HEALTH CARE COALITION OF LAFAYETTE COUNTY
300367399	HOSPITAL HILL RUN INC
300372120	SALINE PUBLIC HEALTH FUND INC
300374362	NORTHERN CALIFORNIA BIBLE COLLEGE CORP
300390480	AUXILIARY OF DEARBORN COUNTY HOSPITAL INC
300401605	PARTNERS FOR SUSTAINABLE HEALTHY COMMUNITIES INC
300403374	COSERV ELECTRIC GROUP HEALTH BENEFIT PLAN TRUST
300408781	ILLINOIS CAMPUS COMPACT CO DEPAUL UNIVERSITY
300438673	CATHOLIC ARCHDIOCESE OF SEATTLE CLERGY MEDICAL PLAN TRUST
300438969	HEALTH FOR EVERYONE
300449673	OREGON ORAL HEALTH COALITION
300453721	SAFE HEALTHY AFFORDABLE RELIABLE ENERGY IN NEW YORK
300491563	MIDWEST HEALTH INITIATIVE
300502122	SUSTAINABLE HEALTH ENTERPRISES INC
300505256	SIMON FRASER UNIVERSITY
300516947	ONE HEALTH ORGANIZATION
300541840	UNIVERSITY PLAZA REHABILITATION AND NURSING CENTER INC
300558038	COLORADO REGIONAL HEALTH INFORMATION ORGANIZATION
300563618	CHAPMAN UNIVERSITY FOUNDATION
300564526	WASHINGTON TOWNSHIP MEDICAL FOUNDATION
300564734	CORSICA RIVER MENTAL HEALTH SERVICES INC
300571387	BETH ISRAEL MEDICAL CENTER FOUNDATION INC
300571390	ST LUKES ROOSEVELT HOSPITAL CENTER FOUNDATION INC
300584463	MERCY HEALTH SOUTHWEST MISSOURIKANSAS COMMUNITIES
300614874	LATINO HEALTH INSURANCE PROGRAM INC
300634510	HEART GROUP OF LANCASTER GENERAL HEALTH
300640372	PREMIUM HEALTH INC
300650092	VISION INTERNATIONAL UNIVERSITY OF FLORIDA
300650211	BAXTER REGIONAL HEALTH SYSTEM
300652791	SOCIETY FOR HEALTHCARE EPIDEMIOLOGY OF AMERICA EDUCATION AND RESEARCH FOUNDATION
300666184	COMMUNITY HEALTH ASSOCIATION INLAND SOUTHERN REGION
300672911	WAYNE COUNTY HEALTHY COMMUNITIES
300697646	AEROSPACE MEDICAL ASSOCIATION
300709486	ALLIANCE OF HEALTH INSURERS UA
300713501	SHS COMMUNITY HEALTH INC
300765570	BAILEYS CROSSROADS HEALTH ACCESS PARTNERSHIP INC
300790805	AMETHYST HEALTH INC
300793395	LOMA LINDA UNIVERSITY HEALTH PARTNERS
300796418	RIVERSIDE MEDICAL CLINIC CHARITABLE FOUNDATION
300800554	SCCP HEALTH AND WELFARE BENEFIT PLAN
300810128	PARAGON COMMUNITY HEALTHCARE INC
300839250	RESURRECTION HEALTH
300855901	OHIO SCHOOL HEALTH SERVICES ASSOCIATION
300856953	HAWAII TAPERS RETIREE HEALTH REIMBURSEMENT FUND
300885104	NORTHWEST AUTOMOTIVE TRADES ASSOCIATION GROUP HEALTH PLAN
300889914	GROUP HEALTH COMMUNITY FOUNDATION
300923764	JUST HEALTH 510
300949113	EQUALITY AND INCLUSION IN HOSPITALITY INC
300963392	JENNISON ASSOCIATES LLC RETIREE HEALTH BENEFITS TRUST
300990905	CEDARS SINAI HEALTH SYSTEM
300995649	PHI CHI MEDICAL FRATERNITY INC ALPHA BETA ALUMNI ASSOCIATION
301046542	MAN CAVE HEALTH INC
301249952	HOPE HEALTH ALLIANCE INC
306069516	ELLIOTT FAMILY TRUSTFBO SOMERSET COMM COLLEGE
306135422	WASHINGTON STATE RURAL HOSPITAL INSURANCE TRUST
306135803	M1 SUPPORT SERVICES LP HEALTH AND WELFARE WELFARE TRUST FUND
306380369	EMERITI RETIREMENT HEALTH PLAN FOR
306380795	VAN RU CREDIT CORPORATION HEALTH AND WELFARE BENEFIT TRUST
306599079	BOA RETIREE TRUST-BAC MEDICAL
310474650	UNIVERSITY CLUB OF CINCINNATI
310531822	MONTGOMERY COUNTY MEDICAL SOCIETY
310536640	ANTIOCH UNIVERSITY
310536647	CEDARVILLE UNIVERSITY
310536649	CONVALESCENT HOSPITAL FOR CHILDREN AND ORPHAN ASYLUM
310536715	UNIVERSITY OF DAYTON
310537130	CHILDRENS HOSPITAL
310537177	BOARD OF DIRECTORS OF WITTENBERG COLLEGE
310537514	WILMINGTON COLLEGE
310537516	XAVIER UNIVERSITY
310544271	GODS BIBLE SCHOOL COLLEGE AND MISSIONARY TRAINING HOME
310561070	PIPEFITTERS UNION HEALTH AND WELFARE FUND LOCAL 392
310577529	FERNALD MEDICAL SCREENING AND UNION
310604719	WILBERFORCE UNIVERSITY
310619689	PLUMBERS AND PIPEFITTERS LOCAL 162 HEALTH AND INSURANCE FUND
310642653	ALLWELL BEHAVIORAL HEALTH SERVICES
310643552	CINCINNATI CHRISTIAN UNIVERSITY
310645626	FAIRFIELD MEDICAL CENTER
310656412	UFCW UNIONS AND EMPLOYERS HEALTH AND WELFARE PLAN OF CENTRAL OHIO
310668711	ASSOCIATION OF OHIO HEALTH COMMISSIONERS
310669872	BUTLER BEHAVIORAL HEALTH SERVICES INC
310679012	COLUMBUS MEDICAL ASSOCIATION FOUNDATION
310707369	FRANKLIN UNIVERSITY
310714767	MT HEALTHY CHRISTIAN HOME INC
310720849	SCIOTO PAINT VALLEY MENTAL HEALTH CENTER INC
310725957	MOUNT VERNON NAZARENE UNIVERSITY
310732512	UNIVERSITY OF CINCINNATI MEDICAL CENTER AUXILIARY INC
310746875	ASSOCIATION OF INDEPENDENT COLLEGES AND UNIVERSITIES OF OHIO
310747997	UNION INSTITUTE AND UNIVERSITY
310749885	CENTRAL STATE UNIVERSITY FOUNDATION
310782819	LOCAL 212 IBEW HEALTH AND WELFARE TRUST FUND
310785627	FAMILY HEALTH SERVICES OF EAST CENTRAL OHIO
310792022	CENTRAL COMMUNITY HEALTH BOARD OF HAMILTON COUNTY INC
310792741	TRI-STATE BIBLE COLLEGE
310802091	JACKSON COUNTY HEALTH FACILITIES INC
310802647	GREATER CINCINNATI BEHAVIORAL HEALTH SERVICES
310806232	NATIONAL REGISTRY OF EMERGENCY MEDICAL TECHNICIANS
310820394	COLUMBUS COLLEGE OF ART AND DESIGN
310822524	HEALTHCARE CONNECTION INC
310840764	CHATFIELD COLLEGE
310843758	SHAWNEE MENTAL HEALTH CENTER INC
310846860	NEW HORIZONS MENTAL HEALTH SERVICES INC
310847283	NORTH CENTRAL MENTAL HEALTH SERVICES INC
310860366	TRI-COUNTY MENTAL HEALTH AND COUNSELING SERVICES INC
310865346	AMERICAN ASSOCIATION OF UNIVERSITY PROFESSORS UNIVERSITY OF CINCINNATI
310870694	HEALTH RECOVERY SERVICES INC
310873015	WEST COLLEGE HILL NEIGHBORHOOD SERVICES INC
310873280	COLLEGE HILL COMMUNITY URBAN REDEVELOPMENT CORPORATION
310876202	MADISON COUNTY HOSPITAL INC
310883916	OHIO - MICHIGAN ASSOCIATION OF CAREER COLLEGES AND SCHOOLS
310884250	HEALTHSOURCE OF OHIO INC
310884880	GREENE MEMORIAL HOSPITAL AUXILIARY
310889458	TUG RIVER HEALTH ASSOCIATION INC
310889730	BLUESTONE HEALTH ASSOCIATION INC
310890208	PERRY BEHAVIORAL HEALTH CHOICES
310896555	UNIVERSITY OF CINCINNATI FOUNDATION
310897161	MORGAN BEHAVIORAL HEALTH CHOICES
310901001	INDEPENDENT COLLEGES OF INDIANA INC
310904251	MEDICAL CENTER FUND OF CINCINNATI INC
310912280	COLLEGE EDUCATIONAL AND CHARITABLE FOUNDATION
310914893	NORTH COLLEGE HILL COMMUNITY SENIORS INC
310914919	NORTON HEALTHCARE FOUNDATION INC
310918571	OHIO HEALTH INFORMATION MANAGEMENT ASSOCIATION INC
310920577	FRIENDS HEALTH CARE ASSOCIATION INC
310923040	AMERICAN COLLEGE OF EMERGENCY PHYSICIANS - OHIO CHAPTER
310923041	NEW YORK CHAPTER AMERICAN COLLEGE OF EMERGENCY PHYSICIANS INC
310923340	MT HEALTHY ATHLETIC BOOSTERS
310925968	UNIVERSITY MEDICAL ASSOCIATES INC
310932681	INTERACT FOR HEALTH
310937036	CLARK STATE COMMUNITY COLLEGE FOUNDATION
310942184	WIRT COUNTY HEALTH SERVICES ASSOCIATION INC
310943109	AMERICAN ANIMAL HOSPITAL ASSOCIATION FOUNDATION INC
310944046	AMERICAN COLLEGE OF EMERGENCY PHYSICIANS NEW JERSEY CHAPTER
310944925	UNIVERSITY OF KENTUCKY MARKEY CANCER FOUNDATION INC
310951018	OHIO COUNCIL OF BEHAVIORAL HEALTH AND FAMILY SERVICES PROVIDERS
310952775	LAPORTE HOSPITAL FOUNDATION INC
310958969	ST GEORGE MEDICAL CLINIC INC
310961926	HARTS HEALTH CLINIC INC
310962004	FORT GAY PRIMARY HEALTH CARE INC
310968012	OHIO SICKLE CELL HEALTH ASSOCIATION INC
310970262	MARTIN UNIVERSITY INC
310971599	OHIO CHRISTIAN UNIVERSITY
310978440	GREENUP COUNTY EMERGENCY MEDICAL SERVICES INC
310981847	AMRITSAR MEDICAL AND DENTAL ALUMNI ASSOC OF NORTH AMERICA
310983135	CINCINNATI STAGE EMPLOYEES LOCAL NO 5 HEALTH AND WELFARE FUND
310984513	HOCKING VALLEY COMMUNITY HOSPITAL MEMORIAL FUND INC
310986036	LOGANSPORT MUNICIPAL UTILITIES EMPLOYEE HEALTH AND BENEFIT PLAN
310988400	HENDRICKS COUNTY HEALTH FOUNDATION
310989171	WEST VIRGINIA VETERINARY MEDICAL ASSOC INC
310992486	INDIANA UNIVERSITY HEALTH PAOLI HOSPITAL FOUNDATION INC
310992960	SOCIETY FOR MEDICAL DECISION MAKING INC
310995840	HAGGIN MEMORIAL HOSPITAL FOUNDATION INC
311000352	NOVA BEHAVIORAL HEALTH INC
311000354	OHIO VALLEY FLOORING GROUP MEDICAL BENEFIT TRUST
311001446	OHIO ASSOCIATION OF HEALTH PLANS INC
311002913	PREGNANCY DECISION HEALTH CENTERS
311003236	MOREHEAD STATE UNIVERSITY FOUNDATION INC
311003977	INDIANA HEALTH CENTERS INC
311010071	FAYETTE MEMORIAL HOSPITAL FOUNDATIONINC
311011321	MARIETTA HEALTH FOUNDATION
311012162	MUSKINGUM BEHAVIORAL HEALTH INC
311012363	UNIVERSITY CENTER FOR SENIOR CITIZENS INC
311016570	ST JOSEPH COMMUNITY HEALTH FOUNDATION INC
311024957	HAMILTON CASTER EMPLOYEE HEALTH PLAN TRUST
311025701	F AND M MAFCO EMPLOYEE HEALTH PLAN TRUST
311027660	BETHESDA HEALTHCARE INC
311035280	COLUMBUS STATE COMMUNITY COLLEGE DEVELOPMENT FOUNDATION INC
311040228	MEDAMERICA HEALTH SYSTEMS CORP
311040231	MIAMI VALLEY HOSPITAL FOUNDATION
311044774	INDIANA COMPREHENSIVE HEALTH INSURANCE ASSOCIATION
311045247	DAYTON CHILDRENS HOSPITAL FOUNDATION
311048513	CROSSROADS BIBLE COLLEGE INC CO COLLEGE OF BIBLICAL STUDIES
311048567	BNAI BRITH HILLEL FOUNDATION AT THE OHIO STATE UNIVERSITY
311051688	KETTERING ADVENTIST HEALTHCARE
311052068	WESTERVILLE SYMPHONY AT OTTERBEIN UNIVERSITY
311063422	SOUTHERN OHIO PAINTERS HEALTH AND WELFARE FUND
311066871	ST VINCENT MERCY HOSPITAL FOUNDATION INC
311066881	WEST VIRGINIA HEALTH RIGHT INC
311068777	INDIANA PRIMARY HEALTH CARE ASSOC INC
311069321	PHYSICIANS HEALTH PLAN OF NORTHERN INDIANA INC
311072144	UNIVERSITY OF CINCINNATI VOLUNTARY TIAA
311072162	WITHAM HEALTH SERVICES FOUNDATION INC
311073544	UNIVERSITY OF KENTUCKY MINING ENGINEERING FOUNDATION INC
311074015	PERRY COUNTY MEMORIAL HOSPITAL FOUNDATIONINC
311074019	OUTDOOR VENTURE CORPORATION HEALTH BENEFIT TRUST
311074243	HOSPITAL ONCOLOGY PROGRAM EXTENDED OF WABASH INC CO AMY POOLE
311074519	TRIHEALTH PHYSICIAN INSTITUTE
311075381	FIDELITY HEALTH CARE
311076169	UNIVERSITY OF LOUISVILLE TRUST
311079213	ATRIUM MEDICAL CENTER FOUNDATION
311080885	CHRIST HOSPITAL INC
311081020	KNOX COMMUNITY HOSPITAL FOUNDATION
311088984	COMPREHENSIVE HEALTH CARE TRUST
311092891	HARNESS HORSEMENS HEALTH AND RETIREMENT INC
311096217	LICKING MEMORIAL HEALTH FOUNDATION
311096218	LICKING MEMORIAL HEALTH SYSTEMS
311096222	CABELL HUNTINGTON HOSPITAL FOUNDATION INC
311096390	AMERICAN COLLEGE OF SPORTS MEDICINE FOUNDATION INC
311099927	THOROUGHBRED HORSEMENS HEALTH FUND
311104492	INTERNATIONAL ALLIANCE OF THEATRICA STAGE EMPL LOC 66 HEALTH AND INS FND
311105952	GREATER CINCINNATI HOSPITAL COOPERATIVE SERVICES
311106338	ZANE STATE COLLEGE FOUNDATION
311106941	UNIVERSITY OF LOUISVILLE ATHLETIC ASSOCIATION
311111784	INDIANA UNIVERSITY HEALTH BALL MEMORIAL HOSPITAL FOUNDATION INC
311112281	HEALTH SERVICES OF COSHOCTON COUNTY INC
311113966	MOUNT CARMEL HEALTH SYSTEM FOUNDATION
311114642	SOUTHEASTERN IN HEALTH MANAGEMENT INC
311115810	SHAWNEE STATE UNIVERSITY DEVELOPMENT FOUNDATION
311116601	HEALTH KENTUCKY INC
311118075	UNIVERSITY HEALTHCARE FOUNDATION INC
311118087	COMMONWEALTH HEALTH CORPORATION INC
311118673	MILAN PUSKAR HEALTH RIGHT INC
311122867	BAPTIST HEALTHCARE FOUNDATION INC
311122883	PREMIER COMMUNITY HEALTH
311124331	GOLD MEDAL PRODUCTS CO EMPLOYEE HEALTH BENEFIT PLAN
311126780	EQUITAS HEALTH INC
311127485	KETTERING AFFILIATED HEALTH SERVICES INC
311127580	GREATER NORTH CLARK HEALTHCARE FDN
311132066	ESKENAZI HEALTH FOUNDATION INC
311132444	NOBLE BEHAVIORAL HEALTH CHOICES INC
311138311	COMMUNITY MENTAL HEALTH CENTERS OF WARREN COUNTY INC
311139276	CONSOLIDATED HEALTH SYSTEMS INC
311145986	OHIO STATE UNIVERSITY FOUNDATION
311146505	UNIVERSITY OF KENTUCKY GLUCK EQUINE RESEARCH FOUNDATION INC
311148352	GUERNSEY HEALTH SYSTEMS
311149074	GREENE COUNTY GENERAL HOSPITAL FOUNDATION
311149085	WHEELING HEALTH RIGHT INC
311155292	HEALTHY MOMS AND BABES INC
311155352	HOPEWELL HEALTH CENTERS INC
311156690	HOLZER HEALTH SYSTEM
311158779	CINCINNATI STATE TECHNICAL AND COMMUNITY COLLEGE AAUP
311169337	MENTAL HEALTH AND RECOVERY CENTER OF CLINTON COUNTY INC
311181984	C H HEALTH SERVICES COMPANY
311181991	COMMUNITY HOSPITAL HEALTH SERVICES FOUNDATION
311182378	CINCINNATI HEALTH NETWORK INC
311182425	HEALTHY VISIONS
311190239	WHITLEY MEMORIAL HOSPITAL FOUNDATION INC
311195036	ERNIE GREEN INDUSTRIES INC HEALTH AND WELFARE TRUST
311196888	OHIO CHILDRENS HOSPITAL ASSOCIATION
311206047	GOOD SAMARITAN HOSPITAL FOUNDATION OF CINCINNATI INC
311206071	HOSPITAL PROPERTIES INC
311209378	DEACONESS HEALTH ASSOCIATIONS FUND INC
311214359	HANCOCK COUNTY SCHOOLS HEALTH
311221836	GREATER DAYTON AREA HOSPITAL ASSOCIATION
311231708	HONDA MFG HEALTH AND WELFARE BENEFITS TRUST
311231905	TIPTON COUNTY HEALTH CARE FOUNDATION INC
311243003	ASSOC OF COLLEGE AND UNIV HOUSING OFFICERS INTL-RESEACH AND EDUC FDN
311243129	GUERNSEY HEALTH CHOICES INC
311245120	CLIPPARD INSTRUMENT LABORATORY INC HEALTH CARE PLAN AND TRUST
311246809	UNIVERSITY OF CINCINNATI PHYSICIANS INC
311257250	MCV HEALTH CARE FACILITIES INC
311273785	GRACEWORKS LUTHERAN SERVICES HEALTH BENEFIT TRUST
311297832	OHIO LIFE AND HEALTH INSURANCE GUARANTY ASSOCIATION
311301428	ARTHUR G JAMES CANCER HOSPITAL AND RICHARD J SOLOVE RESEARCH INSTITUTE
311305635	TCN BEHAVIORAL HEALTH SERVICES INC
